artists,name,genres
Marina Polixronopoulou,O kampos eprasinise,Unknown
Mae Karthauser,The Thousand Year Old Men,Unknown
"Leonard Bernstein,  New York Philharmonic","Symphonic Dances (From ""West Side Story""): IV. Mambo (Meno presto)",Unknown
Hot Tuna,99 year Blues,"blues, blues rock, Hot Tuna, rock, folk-rock"
Tanguturi Suryakumari,Jhanajhana,Unknown
Tetrium,Anything Is Possible - 2008 Mix,Unknown
"Stathis Kavouras,  Giannis Konstantinou,  Giorgos Papadopoulos,  Tasos Kostopoulos",Vlepeis ekeino to vouno,Unknown
"Noel Coward,  Andre Kostelanetz & His Orchestra,  Frank Miller,  Julius Baker,  Leonid Hambro,  Jascha Zayde",The Carnival of the Animals,Unknown
The Swinging Blue Jeans,Get Rid of Her - 2008 Remaster,Unknown
Transient,A Sour Winter Live at Rotture 2008,Unknown
Viorel Demetriad,De-ar fi din lumea-ntreagă,Unknown
Francisco Canaro,Casas Viejas - Remasterizado,Unknown
Fred Baker,Ibiza Project 2009 - Electro Extended Mix,Unknown
Jüsan,Trill Life,Unknown
Stavros Tzouanakos,Tha do kai ta xairia sou,Unknown
"Jüsan,  Kidd Kold",Take It Slow,Unknown
Mixalis Thomakos,Me t'aidonia,Unknown
"Lata Mangeshkar,  Mohammed Rafi",Lagi Hai Aag Dil Men,Unknown
"Luigi Denza,  Richard Tucker,  Nicolas Flagello,  Columbia Symphony Orchestra",Occhi turchini!,Unknown
Jüsan,So Long,Unknown
Geeta Dutt,Bhulnewale Tujhe Apni Jafaon Ki,Unknown
Δημήτρης Περδικόπουλος,Παλεύω με τα κύματα,Unknown
"Fotis Polimeris,  Νίκος Γούναρης",Ήθελα να 'μουνα Αδάμ,Unknown
Leonard Bernstein,On The Town: Dance: The Real Coney Island - Excerpt,Unknown
Jüsan,Keep It Trill,Unknown
Jüsan,Wishes,Unknown
"Alec ""Guitar Slim"" Seward",It's My Desire,Unknown
Ορχήστρα Σπύρου Περιστέρη,Νησιώτικος συρτός,Unknown
Thanasis Varsamas,Fora ta maura,Unknown
Jüsan,Dreaming,Unknown
Markos Vamvakaris,Ores Me Threfei O Ntounias,Unknown
Rita Ampatzi,Treis orfanes,Unknown
Alekos Dimou,H Xriso den efanike,Unknown
"Jüsan,  Zena,  Tursha Gray",Tonight,Unknown
Jüsan,Delusions of Grandeur,Unknown
Marina Polixronopoulou,Sti Roumeli,Unknown
"Jüsan,  Komadyan,  Jinx",Buffalo,Unknown
Panagiotis Plastiras,Gaitanaki,Unknown
Δημήτρης Περδικόπουλος,Οι καιροί,Unknown
Stelios Kazantzidis,To kourasmeno mou to soma,Unknown
"Leonard Bernstein,  Columbia Jazz Combo","Prelude, Fugue & Riffs: II. Fugue",Unknown
"""Female NGoundi soloist,  girls chorus""","N'Goundi Girls' Song (Female Chorus, Handclapping)",Unknown
"Marc Lavry,  Richard Tucker,  Thomas Z. Shepard",Kinereth,Unknown
"Heitor dos Prazeres,  Paulo De Oliveira",Vou Te Abandonar,Unknown
Jüsan,Ain't Meant to Be,Unknown
Νίτσα Μόλλυ,Σενιορίτα,Unknown
Roza Eskenazi,Xronia sti ksenitia,Unknown
Poza Eskenazi,Sexnaz Manes,Unknown
Jüsan,Doper Than Most,Unknown
"Female Okandi chorus,  three male drummers","Okandi Women's Song (Female Chorus, Drums)",Unknown
Danny Kaye,The Great Donivitch Kayeoff,Unknown
Δημήτρης Αραπάκης,Ο Μενούσης κι ο Μπερμπίλης,Unknown
"Gayatri Bose,  Dwijen Mukherjee","Eito Sabe Shuru Bisambad (From ""Krishan"")",Unknown
"Edwin Yearwood,  Shurwayne Winchester",We Ready To Go,Unknown
Ted Heath,Learnin' the Blues,"instrumental, cover, covers, 50s, 1950s"
"Ν.Φραγγιά,  Κώστας Κοντόπουλος",Η Πιπίτσα μας,Unknown
Avelino Muñoz,El Pechiblanco,Unknown
"Jose Amnesia,  Jennifer Rene",Louder - Original Mix Edit,Unknown
Arksun,Arisen - Radio Edit,Unknown
Stathis Koukoularis,Konialis,Unknown
"Niklas Harding,  Arcane",Ice Beach - Original Mix Edit,Unknown
"Lallubhai Naik,  Shireen",Tumhin Ne Mujhko Maar Khilaya,Unknown
Mischa Daniels,Take Me Higher - Original Mix,Unknown
Foxy,คนที่ไม่เข้าตา,Unknown
C-Quence,Endorphine - Arizona Remix Edit,Unknown
Simon & Shaker,Zero - Radio Edit,Unknown
"Νίκος Τζουγάνος,  Αλέκος Καραβίτης",Συρτός Κισσάμου,Unknown
"Heitor dos Prazeres,  Mario Reis",Vai Mesmo,Unknown
Raj Khosla,Rail Mein Jiya Mora,Unknown
"Gabriel & Dresden,  Molly Bancroft",Tracking Treasure Down - Original Mix Edit,Unknown
"Wolfgang Amadeus Mozart,  Staatskapelle Dresden,  Theo Adam,  Otmar Suitner","Zaide, K. 344, Akt II: Wer hungrig bei der Tafel sitzt",Unknown
Roza Eskenazi,Stis Athinas tis omorfies,Unknown
Anton Welin,My Woman,Unknown
"Edwin Yearwood,  Shurwayne Winchester",We Ready to Go (feat. Shurwayne Winchester),Unknown
Last Years Forecast,Good in Small Doses,Unknown
Sotiria Bellou,Na figeis na me afiseis,Unknown
Geeta Dutt,Hamen Apne Dil Se Juda,Unknown
"Amy Beach,  Inga Nielsen,  Arne Nielsen","3 Browning Songs, Op. 44: The Year's at the Spring, Op. 44, No. 1",Unknown
"Arturo Buzzi-Peccia,  Richard Tucker,  Alfredo Antonini,  Columbia Concert Orchestra","Lolita ""Spanish Serenade""",Unknown
Last Years Forecast,Dark Intentions,Unknown
Last Years Forecast,Take Another Breath,Unknown
Hesen Zîrek,Bot Dênim Bot Dênim,Unknown
Last Years Forecast,What It Takes to Convince You,Unknown
Marc Pattison,Whomp,Unknown
Last Years Forecast,Don't Skip It,Unknown
Last Years Forecast,Inspired by Your Worst Creation (Demo),Unknown
Krishan Dayal,Is Dil Ka Bungla Khali Hai,Unknown
Marc Pattison,Downtown Blues,Unknown
Bird Thongchai,น้านา...,Unknown
Tai Chutima,ฤดูรัก,Unknown
Hateful Monday,Withered Skin,Unknown
Manna Dey,Yeh Khel Hain Taqdeer Ke,Unknown
Эрнест Хемингуэй,"Часть 85.3 - За рекой, в тени деревьев",Unknown
Cristian Vasile,"Ei da, așa ceva",Unknown
Alekos Kitsakis,Kainourgia logia mou hrthane,Unknown
Matthew Dekay,Timeless,"trance, Progressive"
Эрнест Хемингуэй,Часть 7.3 - Зеленые холмы Африки,Unknown
"Franz Joseph Haydn,  Pro Arte Quartet","Haydn: String Quartet No. 63 in B-Flat Major, Op. 76 No. 4, Hob. III, 78, ""Sunrise"": II. Adagio",Unknown
"Emanuele Nutile,  Richard Tucker,  Alfredo Antonini,  Columbia Concert Orchestra","Mamma mia, che vo' sapé",Unknown
"Shamshad Begum,  Dilip Kumar",Jadoo Bhare Nainon Men,Unknown
"Mischa Daniels,  Aisata",So Strong - Extended Mix,Unknown
Lata Mangeshkar,Bala Hovu Kashi Utarai,Unknown
Эрнест Хемингуэй,"Часть 52.3 - За рекой, в тени деревьев",Unknown
"Geeta Dutt,  Shamshad Begum",Kabhi Jamuna Ke Paar,Unknown
"Ludwig van Beethoven,  Zino Francescatti,  Robert Casadesus","Violin Sonata No. 5 in F Major, Op. 24 ""Spring"": I. Allegro","Classical, violin"
"Leonard Bernstein,  Symphony Of The Air,  New York Philharmonic,  Lukas Foss","Serenade for Solo Violin, Strings, Harp and Percussion after Plato's ""Symposium"" (1954): I. Phaedrus: Pausanias (Lento - Allegro)",Unknown
Kern,I'm gonna run,Unknown
Meena Kapoor,Lo Jawani Ka Zamana Aa Gaya,Unknown
"DJ Shah,  Adrina Thorpe",Who Will Find Me - Main Mix,Unknown
"Sholom Secunda,  Richard Tucker",Sim Sholom (Prayer of Peace) - Voice,Unknown
Takis Karnavas,Exe geia kaimene kosme,Unknown
"André Breton,  André Parinaud",La rupture avec Dada / Rencontres et ruptures,Unknown
Kern,Shine on - (Life),Unknown
Kern,Follow me down,Unknown
Эрнест Хемингуэй,Часть 36.3 - Зеленые холмы Африки,Unknown
"Sinclair Lewis,  Frank Arnold","Das ist bei uns nicht möglich, Kapitel 206",Unknown
"Max Reger,  Karl Böhm,  Staatskapelle Dresden","Reger: Variations and Fugue on a Theme of Mozart, Op. 132: V. Var. IV (Vivace)",Unknown
Lead Belly,Mr Tom Hughes Town (137-A),Unknown
Эрнест Хемингуэй,Часть 30.3 - Зеленые холмы Африки,Unknown
Эрнест Хемингуэй,Часть 33.2 - Зеленые холмы Африки,Unknown
Nikos Karakostas,Vegrinada,Unknown
Έλλη Σοφρωνίου,Θέλω τον κόσμο να χαρώ,Unknown
Πέτρος Κυριακός,Το Βαγγελάκι,Unknown
"Franz Joseph Haydn,  Pro Arte Quartet","Haydn: String Quartet No. 23 in F Minor, Op. 20 No. 5, Hob. III, 35: IV. Finale (Fuga a due soggetti)",Unknown
Jean Moscopol,Aș vrea ca să găsesc o fată,Unknown
"Antonín Dvořák,  George Szell,  Cleveland Orchestra","Symphony No. 8 in G Major, Op. 88, B. 163: III. Allegretto grazioso - Molto vivace",Unknown
"Richard Strauss,  Karl Böhm,  Elisabeth Höngen,  Esther Rethy,  Staatskapelle Dresden","Strauss, R: Der Rosenkavalier, Op. 59, TrV 227, Act 3: ""Ist ein Traum, kann nicht wirklich sein"" (Sophie, Octavian)",Unknown
"Sinclair Lewis,  Frank Arnold","Das ist bei uns nicht möglich, Kapitel 83",Unknown
Эрнест Хемингуэй,Часть 38.4 & Часть 39.1 - Зеленые холмы Африки,Unknown
Эрнест Хемингуэй,Часть 67.4 & Часть 68.1 - Зеленые холмы Африки,Unknown
"Eduard Künneke,  Helge Rosvaenge,  Staatskapelle Berlin",Die große Sünderin: Das Leben des Schrenk,Unknown
Marcus Schössow,Mr. White - Original Mix,Unknown
Ted Heath,Cuckoo in the Clock,Unknown
Miss Angurbala,Sajna Mano Meri Batiyan,Unknown
Bhanumathi Ramakrishna,Nijamo Mayo,Unknown
Jüsan,Light It Up,Unknown
Takis Karnavas,Pou isoun perdika grammeni,Unknown
Marscruiser,Not Alone Tonight - Blake Jarrell Club Mix Edit,Unknown
Эрнест Хемингуэй,"Часть 1.4 & Часть 2.1 - За рекой, в тени деревьев",Unknown
"Ottorino Respighi,  London Symphony Orchestra,  Ernest Ansermet","La boutique fantasque, P. 120 (after Rossini): Danse cosaque - Valse brillante",Unknown
"Yvan,  Dan Daniel",Enjoy The Silence,Unknown
Balbir,Bhagwan Tere Zulm Ki,Unknown
Эрнест Хемингуэй,"Часть 85.2 - За рекой, в тени деревьев",Unknown
Stauros Tzouanakos,To parasito,Unknown
Άλκης Παγώνης,Τζεμιλέ,Unknown
Jüsan,Photographic Eye,Unknown
Mohammed Rafi,Bahot Purdard Hai Ae Sunnewalo,Unknown
Jüsan,American Born,Unknown
"Sotiria Bellou,  Καλλιγέρη,  Δημήτρης Σέμσης",Μια φορά στον κόσμο ζούμε,Unknown
"Jüsan,  Jinx",THC Vision,Unknown
"Sholom Secunda,  Richard Tucker",Passover Seder Festival: A Passover Service: Chad Gad'yo - Voice,Unknown
Marika Fratzeskopoulou,Melaxrinoula,Unknown
Alekos Dimou,Litse moi Litse,Unknown
"André Breton,  André Parinaud",Devant la guerre 14-18 / Les germes de l'aventure surréaliste,Unknown
"Giasemi,  Nikos Saragoudas",Athinaia,Unknown
Grigoris Asikis,O epaggelmatias,Unknown
Danai Stratigopoulou,Kartero,Unknown
Kern,Comin' home,Unknown
Kreider,Allegro 2,Unknown
Γιώργος Καβούρας,Κακούργα μάνα,Unknown
"Lata Mangeshkar,  Mohammed Rafi,  C. Ramchandra",Main Hoon Alauddin,Unknown
Stella Xaskil,Xaititze,Unknown
"Johnny Cooper,  The Range Riders",She Was Happy Till She Met You,Unknown
Rajkumari,Kyun Mere Dil Mein Dard Basaya,Unknown
Bill Bonyun,Kleine Jonges,Unknown
The Ravens,You're Always In My Dreams,Unknown
"Emanuele Nutile,  Richard Tucker,  Alfredo Antonini,  Columbia Concert Orchestra","Mamma mia, che vo' sapé",Unknown
Takis Karnavas,Kleftes,Unknown
Markos Vamvakaris,Koula Fragkosiriani,Unknown
"Giasemi,  Nikos Saragoudas",To karavaki pou erxetai,Unknown
Tasia Verra,Me ta aspra se eida simera,Unknown
"Santha Kumari,  Raavu Balasaraswathi",Deepavali,Unknown
Marillion,"Somewhere Else - Live in Port Zélande, 2009",Unknown
Marillion,"Garden Party - Live in Port Zelande, 2009",Unknown
Jorma Kaukonen,99 Year Blues,Unknown
Pranlal Vyas,Kanuda Tari Gowalan,Unknown
Carmen Miranda,Dance Rumba,Unknown
"Richard Wagner,  Sherrill Milnes,  Anton Guadagno","Wie Todesahnung Dämmerung deckt die Lande... O du, mein holder Abendstern",Unknown
Vinayak Rao,Sajan Sun Sapne Ki Baat,Unknown
Springtoifel,Satanische Takte,Unknown
"Francisco Canaro,  Roberto Maida",Rincón Florido - Remasterizado,Unknown
Springtoifel,Weck Worscht & OI!,Unknown
"Richard Wagner,  Bavarian Radio Symphony Orchestra,  Lorin Maazel,  Waltraud Meier","Starke Scheite schichtet mir dort (Brünnhilde, Schlußszene 3. Aufzug)",Unknown
"Devika Rani,  Kishore Sahu",Tum Meri Tum Mere Sajan,Unknown
Carmen Miranda,Eu Dei...,Unknown
Umm Kulthum,Qadet Hayate,Unknown
"Fernando Sor,  Julio Martinez Oyanguren","Grand Sonata, Op. 22: Adagio",Unknown
Μπάντα ελληνικού πυροβολικού,Εμβατήριο - βουκολιές,Unknown
Bashir Qawal,Bharat Ka Sukh Chain Humara,Unknown
Surendra,Agar Deni Thi Hamko Hooro-Jannat,Unknown
Blown Mad,"Count Vac - Reunion-Gig Live at Nordportal, Baden, 2010",Unknown
Hogsnort Rupert,I'm Just a Face in the Crowd (2010),Unknown
K.C.Dey,Darshan Huye Tihare Sajan,Unknown
"Jesse Mader,  Jade Lundgren",Breath by Breath (Mellow Mix 2010) [feat. Jade Lundgren],Unknown
"Padmadevi,  Master Nissar",Bolo Aali,Unknown
"Naseem Bano,  Prem Adib",Manhar Phool Khile Bagiya Men,Unknown
Blown Mad,"Spy Catcher - Reunion-Gig Live at Nordportal, Baden, 2010",Unknown
"Lallubhai Naik,  Ismail,  Shireen",Meri Jaan Maan Lo Ab,Unknown
Zubaida Khanum,Aaye mausum rangeelay suhanay jiya nahin manay,Unknown
"Suraiya,  Mohammed Rafi",Seene Mein Aag Bhadakti Hai,Unknown
Janabai Pawar,Preet Ki Sachi Hai Reet,Unknown
Julio Martinez Oyanguren,Andalucia,Unknown
Blown Mad,"Rockabilly Guy - Reunion-Gig Live at Nordportal, Baden, 2010",Unknown
M. K. Thyagaraja Bhagavathar,Njana Kann Kondu,Unknown
Asha Posle,Har Ek Baat Pe,Unknown
Springtoifel,Treppenhaus,Unknown
Mushy Peas,Seventeen,Unknown
K.C.Dey,Gokul Se Gaye Girdhari,Unknown
Shyam Sunder,Yeh Suna Hai Maine Jadu Hai,Unknown
"Richard Wagner,  Marek Janowski","Die Walküre, WWV 86b: 3. Aufzug: 3. Szene: Leb wohl, du kühnes, herrliches Kind!",Unknown
The 1937 Flood,Moonglow,"Ballad, Appalachian string band, mountain swing band"
Springtoifel,Der Henker,"Skinhead, Oi, deutsche skins"
The 1937 Flood,Midnight Special,"Folk Music, Leadbelly, mountain blues band"
Umm Kulthum,Nami Ya Malaky,Unknown
Francisco Canaro,La Marcha del Football - Remasterizado,Unknown
Ελευθέριος Βενιζέλος,Ομιλία του Ελευθέριου Βενιζέλου στο Λονδίνο,Unknown
Lata Mangeshkar,Basalo Apni Nigahon Mein,Unknown
"Nacho Chapado,  Smaz,  Lou Mullen",Change Is Coming Up - Nacho Chapado Vocal 2010 Mix,Unknown
"Nacho Chapado,  Smaz,  Lou Mullen",Change Is Coming Up - Nacho Chapado Vocal 2010 Mix,Unknown
"Sergei Prokofiev,  Isaac Stern","Violin Sonata No. 2 in D Major, Op. 94bis: IV. Allegro con brio",Unknown
"Ralph Vaughan Williams,  Leopold Stokowski,  New York Philharmonic",Symphony No. 6 in E Minor: II. Moderato,Unknown
"Geraint Jones,  Henry Purcell,  Nahum Tate,  Kirsten Flagstad/Elisabeth Schwarzkopf/Eilidh McNab/Arda Mandikian/Sheila Rex/Anna Pollak/Thomas Hemsley/David Lloyd/Mermaid Singers/Mermaid Orchestra/Geraint Jones","Dido and Aeneas Z626 (ed. Geraint Jones) (2008 Digital Remaster), ACT 2, Scene 1: Echo Dance of the Furies (Orchestra)",Unknown
"Richard Rodgers,  Various Artists,  ""Salvatore DellIsola""",South Pacific: Dites-Moi,Unknown
"Giuseppe Verdi,  Arturo Toscanini,  NBC Symphony Orchestra",Aida: Ritorna vincitor!,Unknown
Robin Majumdar,Ei Banochhaya Oi Banka Path,Unknown
Sandhya Mukherjee,Manusher Mone Bhor Holo Aaj,Unknown
"Antonín Dvořák,  Alexander Zakin,  Isaac Stern","Slavonic Dance in E minor, Op. 46, No. 2",Unknown
"William Walton,  Walter Cassel,  Philadelphia Orchestra,  Eugene Ormandy","Belshazzar's Feast: And in the same hour, as they feasted...",Unknown
"Franz Schubert,  Isaac Stern","Rondo for Violin and Piano in B minor, D 895 ""Rondeau brillant"": Andante","Classical, piano, violin, Franz Schubert, Rondo"
Aaron Copland,"Duo for Flute and Piano: III. Lively, with bounce",Unknown
Shankar,More Ram More Ram,Unknown
"Felix Mendelssohn,  Concertgebouworkest,  Eduard van Beinum","Overture ""A Midsummer Night's Dream"", Op.21, MWV P 3",Unknown
"William Walton,  Edith Sitwell,  Frederik Prausnitz,  The Chamber Orchestra",Facade for Reciter and Orchestra (Poems by Edith Sitwell): Polka,Unknown
"Richard Wagner,  Theo Adam,  Marek Janowski","Die Walküre, WWV 86b: 3. Aufzug: 3. Szene: Loge, hör!",Unknown
"Giuseppe Verdi,  Arturo Toscanini",Aida: Presago il core della tua condanna,Unknown
Husn Banu,Premi Jag Men,Unknown
The Triffids,New Year's Greetings - Demo with Phil Kakulas,Unknown
"André Gide,  Jean Amrouche","De ""L'Immoraliste"" à ""La porte étroite""",Unknown
"Nacho Chapado,  Smaz,  Lou Mullen",Change Is Coming Up - Nacho Chapado Vocal 2010 Mix,Unknown
"Nacho Chapado,  Smaz,  Lou Mullen",Change Is Coming Up - Nacho Chapado Vocal 2010 Mix,Unknown
"Felix Mendelssohn,  Concertgebouworkest,  Eduard van Beinum","Symphony No. 4 In A Major, Op. 90, MWV N 16 - ""Italian"": 4. Saltarello (Presto)",instrumental
"Richard Wagner,  Sir Colin Davis,  Bavarian Radio Symphony Orchestra","Act III: Scene 3: In fernem Land, unnahbar euren Schritten",Unknown
"Nalini Mulgaonkar,  Sheela Shirodkar",Jaan Gai Tori Man Ki Batiyan,Unknown
"Geraint Jones,  Henry Purcell,  Nahum Tate,  Kirsten Flagstad/Elisabeth Schwarzkopf/Eilidh McNab/Arda Mandikian/Sheila Rex/Anna Pollak/Thomas Hemsley/David Lloyd/Mermaid Singers/Mermaid Orchestra/Geraint Jones","Dido and Aeneas Z626 (ed. Geraint Jones) (2008 Digital Remaster), ACT 1: Cupid only throws the dart (Chorus)",Unknown
"Wolfgang Amadeus Mozart,  Concertgebouworkest,  Eduard van Beinum","Symphony No.33 in B flat, K.319: 3. Menuetto",Unknown
Family,The Most Wonderful Time of the Year,Unknown
"Asha Bhosle,  Geeta Dutt",Badal Ghir Aaye Rimjhim,Unknown
"Shamshad Begum,  Ram Punjwani",Na Puchho Gham Ke Maron Se,Unknown
"Fromental Halévy,  Richard Tucker,  Wilfrid Pelletier","La Juive: ""Rachel, quand du seigneur""",Unknown
Bashir Qawal,Chale Kyon Na Meri Naiya,Unknown
G. Krishnaswami Iyengar,Muyyige Muyyi,Unknown
"Francisco Canaro,  Roberto Maida",Milagro - Remasterizado,Unknown
The 1937 Flood,Basin Street Blues,Unknown
"Francisco Canaro,  Roberto Maida",Jugando al Amor - Remasterizado,Unknown
"Francisco Canaro,  Roberto Maida",Pass L'amore - Remasterizado,Unknown
Frank Wedekind,Kapitel 11 - Der Kammersänger,Unknown
Narayan Dutt,Gulli Danda,Unknown
Sitara,Pyar Karnewalon Ke Liye,Unknown
"Geeta Dutt,  Shamshad Begum,  G. M. Durrani",Duniya Ki Andheri Raat Mein,Unknown
Alex Daytona,Guareber Recordings Springtime 2011 Compilation - Alex Daytona Megamix,Unknown
Lata Mangeshkar,Chanda Re Ja Re Ja Re,Unknown
"Talat Mahmood,  Prafulla Chowdhury","Jo Beet Gaya So Beet Gaya (From ""Swyamsiddha"")",Unknown
"Vlada Asanin,  Alex Denne,  D-Blaster",Don Pipa (Original Mix) - Best Of 2011,Unknown
"Geeta Dutt,  Surendra",Kahne Ko Hai Taiyar Magar,Unknown
Leonardo Gonnelli,Poke T (Original Mix) - Best Of 2011,Unknown
Matt Lange,Bad Year Blimp - Original Mix,"electronic, dance, Progressive House, Anjunadeep, House"
"Fernando Sor,  Andrés Segovia","Etude op.6, No.12",Unknown
"Mary Martin,  Lauri Peters",Do-Re-Mi,Unknown
The Bully Wee Band,"The Silvermines, Lady Anne Montgomery (sm) - 2011 Remaster",Unknown
"Pietro Mascagni,  Richard Tucker,  Fausto Cleva","Iris, Act I:""Apri la tua finestra""",Unknown
"""Alan Daveys Eclectic Devils""",Years Ago Miles Away - Live,Unknown
Geeta Dutt,"Chhoti Si Ek Bagiyan Me, Pt. 2",Unknown
"Lata Mangeshkar,  Mukesh",Tirchhi Nazar Ka Tir Chala Kar,Unknown
Mladen Tomic,No Fazma (Original Mix) - Best Of 2011,Unknown
H2,Jazz Club (Original Mix) - Best Of 2011,Unknown
"Todd Glass,  Blake Wexler",Todd Doesn't Want to Shop Alone (2011),Unknown
"Peter Maxwell Davies,  Isaac Stern,  André Previn,  Royal Philharmonic Orchestra",Violin Concerto: III. Allegro non troppo,Unknown
"Todd Glass,  Blake Wexler",Blake Leaves a Voicemail for Todd (2011),Unknown
"Lalita Dewoolkar,  Sudhir Phadke",Chali Na Jaiyo Mohe Chhod Ke,Unknown
"André Gide,  Jean Amrouche",1920: Gide célébre et attaqué,Unknown
Mushy Peas,Fourteen,Unknown
"Wolfgang Amadeus Mozart,  Isaac Stern","IV. Rondeau Allegro from Serenade in D Major, KV 250 ""Haffner""",Unknown
Machito & His Afro-Cuban Orchestra,Tanga - Alternate #2 Take,Unknown
"Jay Lumen,  Sinisa Tamamovic",Double Tap (Original Mix) - Best Of 2011,Unknown
Carlos Montoya,Café De Chinitas,Unknown
Μεγάλη χορωδία ανδρών,Ύμνος Βενιζέλου,Unknown
"Giuseppe Verdi,  Richard Tucker","Rigoletto: ""Ella mi fu rapita! - Parmi veder le lagrime""",Unknown
Max Bett,Snow Lady (Original Mix) - Best Of 2011,Unknown
"Ludwig van Beethoven,  Isaac Stern","Violin Sonata No. 1 in D Major, Op. 12 No. 1: II. Theme and Variations",Unknown
Lata Mangeshkar,Jagmag Tare Jhalke,Unknown
Chris Pennie,16 Year Old Daughter,Unknown
Blisses B,"Thirty Days, Sixty Years (Live)",Unknown
"Big Black Boot,  Zoltan Kontes,  Jerome Robins","Vibrate 2011 - Zoltan Kontes, Jerome Robins Mix",Unknown
Aavepyora,Stone Age Economics & Space Age Tools - 2011 Remaster,Unknown
Blown Mad,"Who's Back - Reunion-Gig Live at Nordportal, Baden, 2010",Unknown
"Benjamin Britten,  Leon Fleisher,  Seiji Ozawa,  Boston Symphony Orchestra","Diversions, Op. 21: Theme. Maestoso",Unknown
Kiev Chamber Choir,"Two Spiritual Songs, Op. 4: I. Psalm (2010)",Unknown
Night Shadows,A Political Year Dirge,Unknown
The 1937 Flood,Lover's Waltz (Live),Unknown
Hot Lips Page,Long Gone Blues,jazz fusion
"""Juan DArienzo""",El horizonte,Unknown
The 1937 Flood,Peggy Day,Unknown
Blown Mad,"Jp Free - Reunion-Gig Live at Nordportal, Baden, 2010",Unknown
Song a Day,Happy New Year Everyone from the Mann Family Players,Unknown
"Surendra,  Miss Bibbo",Pujari More Mandir Men Aao,Unknown
Janabai Pawar,Yehi To Pyare Preet Ki,Unknown
"Francisco Canaro,  Roberto Maida",Novia - Remasterizado,Unknown
Bashir Qawal,Lo Suno Mere Dard Bhare Nale,Unknown
Kiev Chamber Choir,"Two Spiritual Songs, Op. 5: II. Alleluia (2010)",Unknown
"Jose Prats Sirera,  Julio Martinez Oyanguren",L'Hereu (Danza Infantil),Unknown
Harimati,Tora Nahin Kanhaiya,Unknown
Blown Mad,"Pink Cadillac - Reunion-Gig Live at Nordportal, Baden, 2010",Unknown
"DJ Chus,  Pablo Ceballos",Afrika - Coyu '10 Years Later' Mix,Unknown
Geeta Dutt,Ankhion Se Nind Churake Koi Le Gaya,Unknown
"Moonface,  Greg Mak",Know So - Greg Mak Remix Remastered 2011,Unknown
"Manuel de Falla,  Isaac Stern",Suite populaire espagnole: III. Canción,Unknown
"Jason Rivas,  Miss Lyntty",Freed from Desire - Jason's 2011 Club Mix,Unknown
"Moonface,  Sam Russo",Power People - Sam Russo Remix Remastered 2011,Unknown
Adam Gardner,If My Life Was a Song (2011),Unknown
"Onionz,  Tim Cook",Space Bass - Tim Cook Remix Remastered 2011,Unknown
"Moonface,  Fraser Owen",These Sounds - Fraser Owen Remix Remastered 2011,Unknown
"Edward Elgar,  Philharmonia Orchestra,  Andrew Davis","Enigma Variations, Op. 36: Variation 13: Romanza ***",Unknown
"Raymundo Rodrigeuz,  Nik Frattaroli",Chinese Laundry - Raymundo Rodriguez Remix Remastered 2011,Unknown
The Crosstones,It's That Time Of Year (Merry Christmas Time),Unknown
Colin Dale,Thats What Im Here For - 2011 Remaster,Unknown
"Moonface,  Pretty Criminals",These Sounds - Pretty Criminals Remix Remastered 2011,Unknown
Geeta Dutt,Kab Tak Nirdhan Ke Dil Se Khelega,Unknown
"Tini Tun,  Dj Christ",Dig This - Tini Tun Remix Remastered 2011,Unknown
The KBK,Love Theme for a Twisted Mind (2011),Unknown
Blown Mad,"Shake Your Moneymakey - Reunion-Gig Live at Nordportal, Baden, 2010",Unknown
"Nacho Chapado,  Smaz,  Lou Mullen",Change Is Coming Up - Nacho Chapado Coming Up Vocal 2010 Remix,Unknown
"Richard Rodgers,  Various Artists",South Pacific: This Nearly Was Mine,Unknown
"Wolfgang Amadeus Mozart,  London Philharmonic Orchestra,  Eduard van Beinum","Symphony No. 35 in D Major, K.385 ""Haffner"": 4. Finale (Presto)",Unknown
Marillion,"Drilling Holes - Live in Port Zélande, 2009",Unknown
The Triffids,New Year's Greetings - Instrumental,Unknown
Cliff Bennett & The Rebel Rousers,You Make Me Happy - Mono; 2009 Remaster,Unknown
Cliff Bennett & The Rebel Rousers,C C Rider Blues - Mono; 2009 Remaster,Unknown
Cliff Bennett & His Band,I Hear Her Voice - Mono; 2009 Remaster,Unknown
Cliff Bennett & The Rebel Rousers,We're Gonna Make It - Mono; 2009 Remaster,Unknown
Cliff Bennett & The Rebel Rousers,Need Your Loving Tonight - Mono; 2009 Remaster,Unknown
Abandon Kansas,The Earth Falls Asleep (2009 Live),Unknown
Cliff Bennett & The Rebel Rousers,Do You Love Him? - Mono; 2009 Remaster,Unknown
Millenium,Light Your Cigar - Live in Krakow 2009,Unknown
Αλέκος Καραβίτης,Πεντοζάλια Χανιώτικα,Unknown
Sofia Vempo,Kapoio mistiko,Unknown
"Cesare Andrea Bixio,  Richard Tucker,  Alfredo Antonini,  Columbia Concert Orchestra",Torna piccina mia,Unknown
Millenium,My Life Domino - Live in Krakow 2009,Unknown
ANTONIS NTALGKAS,Katinaki,Unknown
Supriti Ghosh,Bonophoole Gantha Mala,Unknown
Porter,In The Shadow Of Seven Years,Unknown
Panos Gavalas,Eimai gios sou min ksexnas,Unknown
"Staatskapelle Dresden,  Otmar Suitner","Symphony No. 40 in G Minor, K. 550: I. Molto allegro",Unknown
Marillion,"Hard as Love - Live in Port Zélande, 2009",Unknown
Cliff Bennett & The Rebel Rousers,It's Drivin' Me Wild - Mono; 2009 Remaster,Unknown
Roli Frei,Swimming Across Your Sea - Strong - 2010,Unknown
"Lata Mangeshkar,  Mohammed Rafi",Main Ne Kaha Babuji,Unknown
"Dan Thomas,  Mab,  Zedd",This Year - Zedd Remix,Unknown
Ivan Gomez,Work My Beats 2010 - Vicente Lara Remix,Unknown
"Byron Nemeth,  Bng 2010",What's Done Is Done (feat. Bng 2010),Unknown
Antonio Teoli,"Legends from Jupiter (From ""Taikodom L.U."") [2010]",Unknown
Roli Frei,Voice of My Soul - Strong - 2010,Unknown
GAIA,Aisha (Official Sail 2010 Anthem) - Radio Edit,Unknown
Roli Frei,Freedom in My Heart - Strong - 2010,Unknown
Cliff Bennett & The Rebel Rousers,If Only You'd Reply - Mono; 2009 Remaster,Unknown
Marillion,"No One Can - Live in Port Zelande, 2009",Unknown
Marillion,"An Accidental Man - Live in Port Zélande, 2009",Unknown
Эрнест Хемингуэй,"Часть 3.3 - За рекой, в тени деревьев",Unknown
Mukesh,Kismat Mein Yehi Likha Tha,Unknown
Marillion,"Cover My Eyes - Live in Port Zélande, 2009",Unknown
