artists,name,genres
"Geraint Jones,  Henry Purcell,  Nahum Tate,  Kirsten Flagstad/Elisabeth Schwarzkopf/Eilidh McNab/Arda Mandikian/Sheila Rex/Anna Pollak/Thomas Hemsley/David Lloyd/Mermaid Singers/Mermaid Orchestra/Geraint Jones","Dido and Aeneas Z626 (ed. Geraint Jones) (2008 Digital Remaster), ACT 3, Scene 2: Your counsel all is urg'd in vain (Dido)",Unknown
"Kanan Devi,  Suchitra Mitra",Amader Jatra Holo Shuru,Unknown
"George Gershwin,  Louise Carlyle,  Lehman Engel",Girl Crazy: Sam and Delilah,Unknown
Ralph Burns,Music For A Stripteaser,Unknown
"Wolfgang Amadeus Mozart,  Concertgebouworkest,  Eduard van Beinum","Symphony No.29 in A, K.201: 1. Allegro moderato",Unknown
Ralph Burns,Sprang,Unknown
"Shanti Sharma,  Rampyari",Le Chal Majhi Le Chal Re,Unknown
Suchitra Mitra,Dekona Amare Dekona,Unknown
Rajkumari,Ek Tir Chala,Unknown
"George Frideric Handel,  Robert Merrill,  Yehudi Menuhin","Xerxes, HWV 40, Act I: May the Fates be Kind ""Ombra mai fu""",Unknown
Lead Belly,"Go Down, Old Hannah",blues
Robin Majumdar,Bhalobeshe Ei Bujhechhi,Unknown
"William Walton,  Edith Sitwell,  Frederik Prausnitz,  The Chamber Orchestra",Facade for Reciter and Orchestra (Poems by Edith Sitwell): Scotch Rhapsody,Unknown
"Ludwig van Beethoven,  Isaac Stern","Violin Sonata No. 4 in A Minor, Op. 23: III. Allegro molto",Unknown
"Pyotr Ilyich Tchaikovsky,  Arturo Toscanini","Manfred Symphony, Op. 58: III. Pastorale. Andante con moto",Unknown
Suraiya,Jo Bhoole Hai Tujhe Ae Dil,Unknown
"Lalita Dewoolkar,  Baryara",Teri Jawani Meri Jawani,Unknown
Future Rapper,NeuroPaleoAutonoEntomology,Unknown
"Guri Prahlad,  Kavadhu",Latpat Ke Pat Pahle,Unknown
"Debabrata Biswas,  Kalipada Sen","Andhakarer Paar Hote (From ""Debi Chowdhurani"")",Unknown
Shamshad Begum,Chhaya Meri Ummeed Ki,Unknown
"Sergei Rachmaninoff,  Robert Merrill,  Yehudi Menuhin","6 Songs, Op. 4, No. 3: In the Silence of the Secret Night",Unknown
"Felix Mendelssohn,  London Philharmonic Orchestra,  Eduard van Beinum","The Hebrides, Op.26 (Fingal's Cave) MWV P 7",Unknown
C. Ramchandra,Pyar Ki Pehli Subah Suhani,Unknown
Lead Belly,"Green Corn (""This Is Jazz"" Broadcast)",Unknown
Эрих Мария Ремарк,Часть 154.3 - Триумфальная арка,Unknown
"Asha Bhosle,  Lata Mangeshkar",Agre Ko Ghaghro Mangwa De Raja,Unknown
Эрих Мария Ремарк,Часть 212.3 & Часть 213.1 - Триумфальная арка,Unknown
"Batu Prolite,  Aysedk,  Gunayas",Şeker,Unknown
"Lord Berners,  Philadelphia Orchestra,  Sir Thomas Beecham",The Triumph of Neptune: Sunday Morning (Intermezzo),Unknown
G. M. Durrani,Zindagani Ka Maza,Unknown
K. Narayan Rao,Jago Sonewale,Unknown
Begum Para,Ae Dil Unhen Bhoole Se Ab Yaad,Unknown
A. R. Oza,Chhe Saaj Samo Sansar,Unknown
"Lord Berners,  Sir Thomas Beecham,  Philadelphia Orchestra",The Triumph of Neptune: The Frozen Forest,Unknown
Allyson Horner,Merry Christmas/Silent Night,Unknown
Max Steiner,Beyond the Forest Part. 9,Unknown
Veronica Gonzalez Day,Crie du coeur,Unknown
"Franz Schubert,  Isaac Stern","Rondo for Violin and Piano in B minor, D 895 ""Rondeau brillant"": Più mosso",Unknown
Suraiya,Char Din Ki Chandni,Unknown
Lata Mangeshkar,Tu Hamse Juda Hai,Unknown
"Γεράσιμος Σάγιας,  Δημήτρης Γκόγκος",Το μαναβάκι,Unknown
Nasim Begum,Hum bhool gaye har baat magar tera piyar naheen bhoolay,Unknown
"Ernest Bloch,  Isaac Stern,  Alexander Zakin",Violin Sonata No. 1: I. Agitato,Unknown
Lata Mangeshkar,Kiti Ga Bai Khatyal,Unknown
"Francisco Canaro,  Roberto Maida",Charito - Remasterizado,Unknown
"Richard Rodgers,  Various Artists",South Pacific: There is Nothin' Like a Dame,Unknown
Natalino Otto,Ufemia,Unknown
"Lata Mangeshkar,  Mohammed Rafi,  Geeta Dutt",Lab Pe Fariyad Hai,Unknown
"William Walton,  New York Philharmonic,  Andre Kostelanetz",Facade Suite No. 1: V. Tarantella,Unknown
Geeta Dutt,Dil Se Tumhari Yaad,Unknown
"K. V. Janaki,  P. Leela",Oridam Thanile,Unknown
"Lata Mangeshkar,  Kishore Kumar",Jai Bholenath Jai Ho Prabhu,Unknown
Andre Kostelanetz & His Orchestra,Dancing in the Dark (From The Band Wagon),Unknown
Эрнест Хемингуэй,"Часть 7.2 - За рекой, в тени деревьев",Unknown
Sundef,Sky Depth,Unknown
Эрих Мария Ремарк,Часть 142.2 & Часть 143.1 - Триумфальная арка,Unknown
Unspecified,Love's Old Sweet Song,Unknown
Male Pétro drummers,Petro Dance (Two Drums),Unknown
Argiro Giannopoulou,Eisai anthos tis kanelas,Unknown
Makis Vasiliadis,Karsilamas Anatolikis Thrakis,Unknown
Orchestra Studio 7,Chella llà - Instrument and base Version,Unknown
Vinodini Dixit,Jag Mein Koi Na Mera Prabhu Ji,Unknown
Toni Maroudas,Antio Pampa antio,Unknown
"Prodromos Tsaousakis,  Nikos Kalergis",Sklava diki sou den tha gino ego pote,Unknown
Vaggelis Konitopoulos,San ilios pali fanikes,Unknown
"Leonard Bernstein,  Lukas Foss,  New York Philharmonic",The Age of Anxiety - Symphony No. 2 for Piano and Orchestra (after W.H. Auden): Part I - a) The Prologue,Unknown
Lata Mangeshkar,Aaj Mere Naseeb Ne Mujhko Rula Diya,Unknown
Giannis Verras,Ampeli mou platifillo,Unknown
Эрнест Хемингуэй,"Часть 67.2 - За рекой, в тени деревьев",Unknown
Theoxaris Pantidis,Koritsia mou anipantra,Unknown
Kiriakos Mapouras,Stin platea tou xorkou mas,Unknown
Jascha Heifetz,Beau Soir - (1/10/1944),Unknown
Surendra,"Jab Apna Begana Ho Jaye (From ""Nagan"")",Unknown
Ghantasala,"Paaluka Raadate, Pt. 2",Unknown
N. Mosxonas,O diavatis tis zois,Unknown
Stelios Kazantzidis,Vithise mou to maxairi,Unknown
"Tomas Ballicora,  Cecilia Pastawski",Duérmete Niño Op. 41 No. 2,Unknown
Sakis Pippidis,Tsifteteli Anatolitiko,Unknown
D.Filipopoulos,Poletta,Unknown
Bill Jenkins and the Virginia Mountain Boys,If I Could Hear My Mother Pray Again,Unknown
Rita Ampatzi,Me zournades me ntaoulia,Unknown
Joe Bushkin,Here In My Arms,jazz fusion
The Cercados,Dyan Ka Na,"philippines, OPM, P-pop, pinoy pop, ppop"
"Γ.Μητσάκης,  Ιω. Γεωργακοπούλου,  Στελλάκης Περπινιαδη",Κάτσε να πιούμε ένα κρασί,Unknown
Roza Eskenazi,Min orkizesai vre pseutra,Unknown
"Maíri Línta,  Vasilis Tsitsanis,  Athanasios Eugenikos",Opa opa vre soultana mou,Unknown
"Giorgos Mitsakis,  Ioanna Georgakopoulou,  Ioannis Tatasopoulos",Tha figo tha me xaseis,Unknown
"Abraham Goldfaden,  Richard Tucker,  Sholom Secunda","Rozhinkes Mit Mandlen (From ""Shulamis"")",Unknown
"Wolfgang Amadeus Mozart,  Staatskapelle Dresden,  Otmar Suitner","Le nozze di Figaro, K. 492: Overture","Classical, opera, opera buffa, classical period, western classical"
Alpana Banerjee,Jodi Tomar Jibane,Unknown
Sotos Panagopoulos,Maria Ntolores,Unknown
"Vincenzo Bellini,  Lucia Aliberti,  Paolo Gavanelli,  Orchester der Deutschen Oper Berlin,  Fabio Luisi",Beatrice di Tenda: Qui di ribello sudditi,Unknown
"Στ.Τσίτσης,  Στ.Στάθης,  Μ.Χαρίσης",Ξενιτεμένο μου πουλί,Unknown
Νίτσα Μόλλυ,Έχω κάτι,Unknown
Talat Mahmood,Jalti Hai Duniya Jalti Rahegi,Unknown
Antonis Ntalkas,Neoi xasiklides,Unknown
Ghantasala,Uyirudan Unaikkaanbeno,Unknown
"Franz Lehár,  Richard Tucker,  Franz Allers,  Columbia Symphony Orchestra","Paganini: ""Love, You Invaded My Senses""",Unknown
Stathis Kavouras,Distixia,Unknown
"Giuseppe Verdi,  Arturo Toscanini",Falstaff: Act II: Scene 2: Ned! Will! Tom! Isaac!,Unknown
"Noel Rosa,  Silvio Caldas",Mão no Remo,"samba, choro"
Stathis Kavouras,Mia kori etragoudage,Unknown
Markos Vamvakaris,Otan Pino Toumpekaki,Unknown
Roza Eskenazi,Mpolsevika,Unknown
Balgandharva,"Aala Jo Maj Perme, Pt. 2",Unknown
"Alexander Scriabin,  Pierre Monteux","Symphony No. 4 in C Major, Op. 54 ""Le Poème de l'extase"": I. Andante - Languido",Unknown
Mohammed Rafi,Tir Pe Tir Khaye Ja,Unknown
"Giuseppe Verdi,  Arturo Toscanini",Aida: A lui vivo la tomba!,Unknown
Günter Kootz,"Für Elise in A Minor, WoO 59",Unknown
"Frédéric Chopin,  Dinu Lipatti","Chopin: Waltz No. 6 in D-Flat Major, Op. 64 No. 1 ""Minute""",Unknown
Pirgaki Filio,Tou Anroutsou h mana,Unknown
Santosh Sengupta,Tomar Akashe Esechhinu,Unknown
Danny Kaye,Benny Rubin,Unknown
Esquivel!,Esquivel Intro,Unknown
King Radio,Chip Chip Water,calypso
"Surinder Kaur,  Talat Mahmood",Poochh Rahe Yaar Ki Bibi,Unknown
Markos Vamvakaris,Kapote Imouna Ke Ego,Unknown
"Stelios Kazantzidis,  María Grílli",To aniliko,Unknown
Lord Melody,Sugar Pie,Unknown
"Johann Sebastian Bach,  Isaac Stern","Trio Sonata in G Major, BWV 1038: III. Adagio","baroque, trio sonata"
"Giuseppe Verdi,  Gino Marinuzzi,  Liana Avogadro,  Maria Caniglia,  ""Orchestra Sinfonica dellEIAR di Torino""","Verdi : La forza del destino : Act 1 ""M'aiuti, signorina"" [Curra, Leonora]",Unknown
"Johann Sebastian Bach,  Isaac Stern,  Pablo Casals,  Prades Festival Orchestra","Violin Concerto in A Minor, BWV 1041: I. Allegro","baroque, violin, Classical, concerto, german"
Эрнест Хемингуэй,"Часть 56.2 - За рекой, в тени деревьев",Unknown
"Prodromos Tsaousakis,  María Grílli",Anthrope glenta ti zoi,Unknown
Tasia Verra,Ta arrovoniasmata,Unknown
Roza Eskenazi,Mpelalis karsilamas,Unknown
Giorgos Papasideris,Κόρη που πας στον ποταμό,Unknown
ChixUnighted,Monlow,Unknown
"Giacomo Puccini,  Fernando Previtali,  Orchestra Lirica e Coro di Milano della RAI",Ave Maria piena di grazia,Unknown
"Giuseppe Verdi,  Manno Wolf-Ferrari,  Coro Lirico di Milano della Rai,  Orchestra lirica di Milano della RAI,  Roberto Benaglio","Verdi : I Lombardi alla Prima Crociata : Act 2 ""La bella straniera che l'alme innamora!"" [Chorus]",Unknown
"Giacomo Puccini,  Fernando Previtali,  Orchestra Lirica e Coro di Milano della RAI","Senza mamma, o bimbo",Unknown
Unspecified,Shiraisi Odori,Unknown
"Camille Saint-Saëns,  Jascha Heifetz","Sonata No. 1, Op. 75, in D Minor: Adagio",Unknown
"Ludwig van Beethoven,  Paul Baumgartner","33 Piano Variations In C, Op.120 On A Waltz By Anton Diabelli: Variation 12 (Un poco più moto)",Unknown
The Skull Cowboy,Kaw-Liga,Unknown
Lata Mangeshkar,Jawani Ke Raste Pe Aaj Mera Dil Hai,Unknown
Satinath Mukherjee,Kotha Tumi Ghanashyam,Unknown
Эрнест Хемингуэй,Часть 18.4 - Старик и море,Unknown
"Asha Bhosle,  G. M. Durrani",Nas Nas Men Meri Bhar Dard Diya,Unknown
Tarun Banerjee,Alta Payer Alto Chhonwa Porechhe,Unknown
"P. Leela,  T. A. Mothi",Panineer Poopole,Unknown
"Vincenzo Bellini,  Maria Callas,  Giuseppe Di Stefano,  Piero Campolonghi,  Robert Silva,  Tanis Lugo,  Ignacio Rufino,  Rosa Rimoch,  Palacio de Bellas Artes Chorus,  Palacio de Bellas Artes Orchestra,  Guido Picco","I puritani: Act I Scene 2: A te, o cara (Arturo)",Unknown
Hermes Nye,The Red Herring,Unknown
Madhubala Jhaveri,Raat Armaan Ki Saji Hai,Unknown
Unspecified,Serbia: Kapetan Cizmic (Folksong),Unknown
"Alban Berg,  Dimitri Mitropoulos","Wozzeck, Op. 7: Act I, Scene II: Andres ""Du, der Platz ist verflucht!""",Unknown
Suraiya,Ek Tu Hai Ek Aas Teri Re Murliwale,Unknown
Sterling Brown,Sharecropper,Unknown
"Ludwig van Beethoven,  Paul Baumgartner","33 Piano Variations In C, Op.120 On A Waltz By Anton Diabelli: Variation 5 (Allegro vivace)",Unknown
"Giuseppe Verdi,  Fernando Previtali,  Ebe Stignani,  Mirto Picchi,  Orchestra Sinfonica di Roma della RAI,  Paolo Silveri","Verdi : Don Carlo : Act 2 ""Ed io che tremava al suo spetto"" [Don Carlo, Eboli, Rodrigo]",Unknown
Эрнест Хемингуэй,Часть 40.4 & Часть 41.1 - Старик и море,Unknown
Michael Sarsfield,Brunettes,Unknown
Toraia Orchestra Of Algiers,Bir Ish Tamal Haavash,Unknown
"César Franck,  Arturo Toscanini","Symphony in D Minor, FWV 48: I. Lento - Allegro non troppo",Unknown
"Franz Schubert,  Rudolf Serkin","6 Moments musicaux, D. 780, Op. 94: No. 2 in A-Flat Major. Andantino",Unknown
Geeta Dutt,Ek Shama Hai Mehfil Men,Unknown
Noro Morales,Tiempos Viejos,Unknown
"Richard Wagner,  Joseph Keilberth,  Bayreuth Festival Orchestra",Siegfried : Act 1 : Fühltest Du Nie Im Hinstren Wald,Unknown
Rampyari,Gokul Avyun Chhe,Unknown
"Ludwig van Beethoven,  Budapest String Quartet","String Quartet No. 2 in G Major, Op. 18: IV. Allegro molto quasi presto",Unknown
"Kristine Akselsen,  Norwegian Gospel Singers",Great is Thy Faithfulness,Unknown
"Ludwig van Beethoven,  Budapest String Quartet","String Quartet No. 5 in A Major, Op. 18: III. Andante cantabile - Variations - Poco adagio",Unknown
"Claude Debussy,  Pierre Monteux","Images pour orchestre, L. 122: I. Gigues",Unknown
Satinath Mukherjee,Path Cheye Shudhu Mor,Unknown
Tarun Banerjee,Mor Malanche Basanta Nai Re Nai,Unknown
Abhram Bhagat,Enun Moddun Mori Jog,Unknown
Asha Bhosle,Ghat Ghat Man Radhani Rat Ia Gi,Unknown
Эрих Мария Ремарк,Часть 81.2 - Триумфальная арка,Unknown
"Ludwig van Beethoven,  Pablo Casals","Cello Sonata No. 5 in D Major, Op. 102 No. 2: III. Allegro",Unknown
"Moti Bai,  Kamala","Dhanwan Jeevan Mane Chhe, Pt. 2",Unknown
"Maurice Ravel,  Robert Casadesus","Valses nobles et sentimentales, M. 61: IV. Assez animé","Classical, instrumental, piano, valses, waltz"
"Supriti Ghosh,  Tarun Banerjee",Ore Aaj Bharater Nabo,Unknown
"Christoph Willibald Gluck,  Arturo Toscanini","Orfeo ed Euridice, Wq. 30: Act II: Scene 1: Dance of a Fury - 1992 Remastered",Unknown
"Richard Wagner,  Inge Borkh,  Günther Treptow,  Hans Hotter,  Ira Malaniuk,  Josef Greindl And Astrid Varnay",Die Walkure : Ein Schwert Verhie Mir Der Vater,Unknown
"Ludwig van Beethoven,  Budapest String Quartet","String Quartet No. 1 in F Major, Op. 18: III. Scherzo. Allegro molto",Unknown
"Bhanumathi Ramakrishna,  Ghantasala",Inba Kaaviyamagum,Unknown
L.M. Hilton,What's the Use of Repining,Unknown
Unspecified,Tunis: Haouli Dance,Unknown
Yves Montand,Rien Dans Les Mains Rien Dans Les Poches,Unknown
"Vincenzo Bellini,  Maria Callas,  Giuseppe Di Stefano,  Piero Campolonghi,  Robert Silva,  Tanis Lugo,  Ignacio Rufino,  Rosa Rimoch,  Palacio de Bellas Artes Chorus,  Palacio de Bellas Artes Orchestra,  Guido Picco",I puritani: Act II: Qual novella? (Chorus),Unknown
L.M. Hilton,"Zack, The Mormon Engineer",Unknown
"Richard Wagner,  Keilberth,  Aldenhoff,  Hotter,  Varnay,  Kuen,  Neidlinger,  Böhme,  Bugarinovic,  Streich","Siegfried : Act 3 : Heil Dir, Sonne! Heil Dir, Licht!",Unknown
"Arrigo Boito,  George London,  Rudolf Moralt,  Wiener Symphoniker",Ecco il mondo from Mefistofele - Vocal,Unknown
"Hector Berlioz,  Concertgebouworkest,  Eduard van Beinum","Symphonie fantastique, Op. 14, H 48: 3. Scène aux champs. Adagio",Unknown
"Richard Wagner,  Joseph Keilberth,  Bayreuth Festival Orchestra","Der Ring Des Nibelungen : Lugt, Schwestern!",Unknown
Müzeyyen Senar,Benden Ayrılsan da,Unknown
Pee Wee King and His Band,San Antonio Rose,Unknown
Эрнест Хемингуэй,Часть 38.4 - Старик и море,Unknown
Andrea McArdle,"Tomorrow - from ""Annie""",Unknown
Ranganath Jadav,Mujhpe Bhi Rahm Mere Mehrban Kijiye,Unknown
"Max Reger,  Erik Then-Bergh","Variations And Fugue On A Theme By Telemann, Op.134: Variation No.11 Quasi adagio",Unknown
Juan Oñatibia,France: Wine Dance Entrance (Basque),Unknown
"Johann Sebastian Bach,  Jo Vincent,  Concertgebouworkest,  Willem Mengelberg","St. Matthew Passion, BWV 244 - Part One: No.12 Recitative (Soprano): ""Wiewohl mein Herz in Tränen schwimmt""",Unknown
"Ludwig van Beethoven,  Paul Baumgartner","33 Piano Variations In C, Op.120 On A Waltz By Anton Diabelli: Variation 1 (Alla marcia maestoso)",Unknown
Asha Bhosle,Aaj Main Jogan Ban Ke,Unknown
"Johann Sebastian Bach,  Ilona Durigo,  Concertgebouworkest,  Willem Mengelberg","St. Matthew Passion, BWV 244 - Part Two: No.59 Recitative (Alto): ""Ach Golgatha""",Unknown
"Giuseppe Verdi,  Ebe Stignani,  Renata Tebaldi,  ""Orchestra dellAccademia Nazionale di Santa Cecilia"",  Alberto Erede",Aida / Act 2: Fu la sorte dell'armi a'tuoi funesta,Unknown
Cornelia Otis Skinner,A Woman of Virtue,Unknown
"Richard Wagner,  Joseph Keilberth,  Bayreuth Festival Orchestra",Der Ring Des Nibelungen : Immer Ist Undank Loges Lohne!,Unknown
"Giuseppe Verdi,  Francesco Molinari-Pradelli,  Carlo Bergonzi,  Orchestra Sinfonica di Roma della RAI,  Walter Monachesi","Verdi : Simon Boccanegra : Act 2 ""Udisti?... Vil disegno!... Sento avvampar nell'anima "" [Gabriele, Paolo]",Unknown
"Shamshad Begum,  Vasanta Kumari",Achhe Din Aa Rahe Ab,Unknown
Roza Eskenazi,Diokse me diokse me,Unknown
"Claude Debussy,  Pierre Mollet,  Suzanne Danco,  ""LOrchestre de la Suisse Romande"",  Ernest Ansermet","Pelléas et Mélisande, L.88 / Act 4: ""C'est le dernier soir""",Unknown
"Traditional,  Irma Kolassi,  Jacqueline Bonneau",The Young Maid Of Alatsata,Unknown
Unspecified,The Rainy Season: Black Howler Monkeys,Unknown
"Johann Sebastian Bach,  Herman Schey,  Concertgebouworkest,  Willem Mengelberg","St. Matthew Passion, BWV 244 - Part Two: No.64 Recitative (Bass): ""Am Abend, da es kühle war""",Unknown
"Ludwig van Beethoven,  Pablo Casals,  Eugene Istomin,  Alexander Schneider","Piano Trio in B-Flat Major, Op. 11 ""Gassenhauer"" (Version for Violin, Cello & Piano): III. Allegretto",Unknown
Νάσος Πατέτσος,"Όλε, Τολέρο!",Unknown
Mabel Mercer,Ivory Tower,Unknown
"Francisco Canaro,  Alberto Arenas",A Media Luz - Remasterizado,Unknown
"Alessandro Scarlatti,  Irma Kolassi,  Jacqueline Bonneau","Il Pompeo: ""Toglietemi la vita ancor"" - 1955 Version",Unknown
Mamlê,Fewziye,Unknown
Caldiero Trio,Italy: Tarantella di Li Mafiusi (Sicily),Unknown
"Giuseppe Verdi,  Aldo Protti,  Renata Tebaldi,  Dario Caselli,  Fernando Corena,  Mario del Monaco,  Ebe Stignani,  ""Coro dellAccademia Nazionale Di Santa Cecilia"",  ""Orchestra dellAccademia Nazionale di Santa Cecilia"",  Alberto Erede","Aida / Act 2: Ma tu, Re, tu signore possente",Unknown
Tarun Banerjee,Sonar Naame Naam Dilo Ke Sundari,Unknown
"Alban Berg,  Dimitri Mitropoulos,  New York Philharmonic","Wozzeck, Op. 7: Act II, Scene III: Largo ""Guten Tag, Franz""..""Ich seh' nichts""",Unknown
"Franz Schubert,  Pablo Casals","Piano Trio No. 1 in B-Flat Major, Op. 99, D. 898: III. Scherzo. Allegro",Unknown
Tarun Banerjee,Tumi Ekti Palash,Unknown
"Gustav Mahler,  Pierre Monteux",Kindertotenlieder: Wenn dein Mütterlein,Unknown
"Lallubhai,  Bhikhu",Hun To Thooloni Dali,Unknown
"Claude Debussy,  Helene Bouvier,  ""LOrchestre de la Suisse Romande"",  Ernest Ansermet","Pelléas et Mélisande, L.88 / Act 1: ""Voici ce qu'il écrit à son frère""",Unknown
"Johann Sebastian Bach,  Karl Erb,  Concertgebouworkest,  Willem Mengelberg","St. Matthew Passion, BWV 244 - Part One: No.9a Evangelist: ""Aber am ersten Tage der süssen Brot""",Unknown
"Johannes Brahms,  Arturo Toscanini","Concerto for Violin & Cello in A Minor, Op. 102: III. Vivace non troppo",Unknown
"Robert Schumann,  Pierre Bernac","Dichterliebe, Op. 48: 1. Im wunderschönen Monat Mai",Unknown
"Robert Schumann,  Pierre Bernac","Dichterliebe, Op. 48: 12. Am leuchtenden Sommermorgen",Unknown
Tarun Banerjee,Madhumati Jay Boye Jay,Unknown
Dhirendranath Das,Amar Shyamla Baran Bangla Mayer,Unknown
Pankaj Mullick,Pratasmarami,Unknown
"Geeta Dutt,  Hemant Kumar",Sun Manush Bhai Sab Men Ek Lahu Ki Dhara,Unknown
"Robert Schumann,  Irmgard Seefried,  Erik Werba","Es fiel ein Reif, Op. 64/2",Unknown
"Richard Strauss,  Arturo Toscanini","Don Quixote, Op. 35 - Fantastic Variations on a Theme of Knightly Character: Introduction",Unknown
"Tony Russo,  Sy Oliver",I'm Walking Behind You,Unknown
"Sudha Malhotra,  Talat Mahmood,  Jagjit Kaur",Mohabbat Ki Dhun Bekararon Se Puchho,Unknown
Эрих Мария Ремарк,Часть 96.2 - Триумфальная арка,Unknown
Asha Bhosle,Yeh Behta Hua Pani Samjha Raha Hai,Unknown
"""Browns Chapel School""",I Must See (Amasee),Unknown
"Lars Gullin,  Lee Konitz,  American All-Stars",Late Date,"jazz, smooth, in love"
Mohammed Rafi,Duniya Mein Hai Bande Pyare,Unknown
Edu Da Gaita,Banzo,Unknown
Wallace House,The Jolly Pinder of Wakefield,Unknown
Lata Mangeshkar,Prit Majhi Bolena,Unknown
"Sergei Prokofiev,  André Cluytens,  Samson François,  Orchestre De La Société Des Concerts Du Conservatoire","Prokofiev: Piano Concerto No. 3 in C Major, Op. 26: III. Allegro ma non troppo",Unknown
Эрих Мария Ремарк,Часть 155.2 - Триумфальная арка,Unknown
Эрих Мария Ремарк,Часть 214.5 & Часть 215.1 - Триумфальная арка,Unknown
K. B. Sundarambal,Muthamizh Deivame,Unknown
Hugh Tracey,Kapchinja - Nandi Tribe,Unknown
Śrī Tārāpadă Kundu,Raghupati Rāghavă Rājā Rāmă,Unknown
Ghantasala,Polaala Nanni Halaala Dunni,Unknown
Satinath Mukherjee,Ami Chole Gele,Unknown
"Richard Wagner,  Keilberth,  Varnay,  Lorenz,  Uhde,  Greindl,  Modl,  Siewert","Götterdämmerung : Act 1 : Heil! Siegfried, Teurer Held",Unknown
"Richard Wagner,  Arturo Toscanini","Die Walküre, WWV 86B: Act I: Scene 3: Ein Minnetraum",Unknown
Talat Mahmood,"Tadap Jana Yahan Tak (From ""Zamane Ki Hawa"")",Unknown
"Ludwig van Beethoven,  Budapest String Quartet","String Quartet No. 2 in G Major, Op. 18: II. Adagio cantabile - Allegro",Unknown
"Wolfgang Amadeus Mozart,  Erich Kunz/Irmgard Seefried/George London/Elisabeth Schwarzkopf/Sena Jurinac/Marjan Russ/Elisabeth Höngen/Erich Majkut/Rosl Schwaiger/Wilhelm Felden/Anny Felbermayer/Hilde Czeska/Chor der Wiener Staatsoper/Wiener Philharmoniker/Herbert von,  Herbert von Karajan,  Wiener Philharmoniker","Le Nozze di Figaro, '(The) Marriage of Figaro', Act IV: Gente, gente, all'armi, all'armi (Tutti)",Unknown
"Richard Wagner,  Inge Borkh,  Astrid Varnay,  Hans Hotter",Die Walkure : Deinen Leichten Sinn La Dich Denn Leiten,Unknown
Unspecified,"2000 Fathoms Down, 200 Miles Out, Pac.",Unknown
Tarun Banerjee,Neelanjana Re,Unknown
"Richard Wagner,  Keilberth,  Varnay,  Lorenz,  Uhde,  Greindl,  Modl,  Siewert,  Bayreuth Festival Orchestra",Götterdämmerung : Act 3 : Hier Sitz Ich Zur Wacht (Hagen),Unknown
Farid al-Atrash,El Mared El Arabi,Unknown
Unspecified,St'an Beit (Stand-by Dance),Unknown
Satinath Mukherjee,Raater Akash Taray Royechhe,Unknown
Francisco Canaro,El Entrerriano - Remasterizado,Unknown
Billy Daniels,Don't Take Your Love From Me,Unknown
"Maurice Ravel,  Robert Casadesus","Miroirs, M. 43: III. Une barque sur l'océan",Unknown
L.M. Hilton,Hard Times Come Again No More,Unknown
Pithapuram Nageswara Rao,Pellichesi Choopisthaam,Unknown
"Giuseppe Verdi,  ""Orchestra dellAccademia Nazionale di Santa Cecilia"",  Alberto Erede",Aida / Act 2: Marcia,Unknown
"Wolfgang Amadeus Mozart,  Rudolf Serkin,  Pablo Casals","Piano Concerto No. 22 in E-Flat Major, K. 482: II. Andante",Unknown
"Claude Debussy,  Suzanne Danco,  Pierre Mollet,  ""LOrchestre de la Suisse Romande"",  Ernest Ansermet","Pelléas et Mélisande, L.88 / Act 3: ""Mes longs cheveux descendent""",Unknown
Divya Vivekanandan,Oh Rasikkum Seemane - Remix,Unknown
Unspecified,150 Snapping Shrimp,Unknown
Fred von Hoerschelmann,Kapitel 13 - Amtmann Enders,Unknown
"Ludwig van Beethoven,  Arturo Toscanini,  NBC Symphony Orchestra","Symphony No. 4 in B-Flat Major, Op. 60: IV. Allegro ma non troppo","Classical, symphony"
"Talat Mahmood,  Geeta Dutt",Chori Chori Dil Men Samaya,Unknown
Luiz Piçarra,Granada,Unknown
"Claude Debussy,  Pierre Monteux","Images pour orchestre, L. 122: III. Rondes de printemps",Unknown
Suchitra Mitra,Tumi Je Amare Chao,Unknown
"Franz Xaver Gruber,  George and Madeleine Brown",Gruber: Silent Night,Unknown
Thanasis Kavourakis,Kerna me pikra kerna me,Unknown
"Hector Berlioz,  Concertgebouworkest,  Eduard van Beinum","Symphonie fantastique, Op. 14, H 48: 4. Marche au supplice. Allegretto non troppo",Unknown
Noro Morales,Las Perlas de Tu Boca,Unknown
Unspecified,"60' Water, Pac.",Unknown
S. D. Batish,Dekh Liya Tune Gham Ka Tamasha,Unknown
"Vincenzo Bellini,  Maria Callas,  Giuseppe Di Stefano,  Piero Campolonghi,  Robert Silva,  Tanis Lugo,  Ignacio Rufino,  Rosa Rimoch,  Palacio de Bellas Artes Chorus,  Palacio de Bellas Artes Orchestra,  Guido Picco",I puritani: Act I Scene 1: Or dove fuggo io mai? (Riccardo),Unknown
Charlie Chaplin,Spring Song with Banjo,Unknown
"Alban Berg,  Dimitri Mitropoulos,  New York Philharmonic","Wozzeck, Op. 7: Act III, Scene I: Invention on a Theme ""Und ist kein Betrug in seinem Munde erfunden worden""",Unknown
"Giacomo Puccini,  Francesco Molinari-Pradelli,  Orchestra Sinfonica e Coro di Torino della RAI",Un tal baccano in Chiesa!,opera
"Giuseppe Verdi,  Fernando Previtali,  Orchestra Sinfonica di Roma della RAI","Verdi : Il trovatore : Part 2 - La Gitana ""Mesta è la tua canzon!"" [Chorus, Azucena, Manrico, Un vecchio zingaro]",Unknown
Unspecified,Bara Sanabo - Bara,Unknown
Honoré de Balzac,Kapitel 4 - Tante Lisbeth,Unknown
"Wolfgang Amadeus Mozart,  Fernando Previtali,  Orchestra Sinfonica e Coro di Roma della RAI",Crudel! perché finora,Unknown
"Giuseppe Verdi,  Fernando Previtali,  Orchestra Sinfonica e Coro di Roma della RAI",Verdi : La battaglia di Legnano : Sinfonia to Act 1,Unknown
"Shiloh Primitive Baptist Church (Bogue Chito,  Miss.)",Prayer Meeting,Unknown
Unspecified,Hora: Girl's Song,Unknown
Josh White,The Lass with the Delicate Air,Unknown
Unspecified,Chang Poo Ta Ryong,Unknown
"Wolfgang Amadeus Mozart,  Eugene Ormandy,  Philadelphia Orchestra","Piano Concerto No. 20 in D Minor, K.466: II. Romance",Unknown
Lola Flores,Tanto Tienes Tanto Vales,Unknown
"Mixed Bokharian singers,  doyra players",Al Matcha Anora,Unknown
"Amirbai Karnataki,  Mohammed Rafi",Ansoo Thi Meri Zindagi,Unknown
"Vincenzo Bellini,  Vittorio Gui,  Orchestra Sinfonica e Coro di Torino della RAI","De con te, con te li prendi",Unknown
Bill Clifton,Love Is The Sweetest Thing,Unknown
Honoré de Balzac,Kapitel 3 - Tante Lisbeth,Unknown
P. U. Chinnappa,Enna Seithai,Unknown
"Império Pedreirense,  Fernando gogo de ouro",A Coroa do Império no Batuque da Pedreira- 1999,Unknown
"Richard Wagner,  Arturo Toscanini","Lohengrin, WWV 75: Act I: Prelude",Unknown
