artists,name,genres
Dion,Drip Drop,"60s, oldies, doo wop, pop, 1963"
Alice Cooper,Halo of Flies,"hard rock, classic rock, rock, Alice Cooper, Progressive rock"
"Rehab,  Denny aka ""Steakknife""","Drinkin' Problem (feat. Denny aka ""Steaknife"") (feat. Denny aka ""Steakknife"")",Unknown
Sam Cooke,That's It - I Quit - I'm Movin' On,"international, SuperSoul, soul peppermint"
Vince Guaraldi,Für Elise,"Classical, christmas, piano, beethoven, instrumental"
Patsy Cline,Just A Closer Walk With Thee,"gospel, country, female vocalists, patsy cline, religious"
"Ray Conniff,  The Ray Conniff Singers",Medley: Let It Snow! Let It Snow! Let It Snow! / Count Your Blessings / We Wish You a Merry Christmas,Unknown
Bobby Vee,More Than I Can Say,"oldies, 60s, bobby vee, more than i can say, Love"
Faith Hill,Cry,"country, Faith Hill, female vocalists, pop, cry"
Vitalij Kuprij,Chopin Etude #11 in a Minor Opus 25,experimental progressive rock
Chicos de Barrio,Yo te invito a bailar - a.k.a. You're the One That I Want,Unknown
Weezer,Burndt Jamb,"rock, alternative, alternative rock, indie rock, indie"
The Used,Greener With the Scenery,"screamo, emo, alternative rock, punk, alternative"
Roy Orbison,I Can't Stop Loving You,"oldies, 60s, rock, pop, country"
"Roman Tam,  Jenny Tseng",鐵血丹心 (無線電視劇[射鵰英雄傳之鐵血丹心]主題曲) - 1998 Digital Remaster;,Unknown
"Medeski,  Martin & Wood",I Wanna Ride You,Unknown
Paul Desmond,A Taste of Honey,"jazz, saxophone, cool jazz, instrumental, Tenor Sax"
Dropkick Murphys,Finnegan's Wake,"punk, irish, celtic punk, punk rock, celtic"
Breaking Benjamin,Medicate,"rock, alternative rock, breaking benjamin, hard rock, alternative metal"
Ice Cube,Ghetto Vet,"Hip-Hop, Ice Cube, rap, West Coast Rap, 90s"
Veronica Leal,No Tengo Miedo Seguir,Unknown
Saliva,Rest In Pieces,"rock, alternative, Saliva, Nu Metal, One Tree Hill"
Pancho Barraza,El Vagabundo Que Te Ama,Unknown
B2K,Gots Ta Be,"rnb, b2k, Love, Omarion, gots ta be"
Frankie Valli & The Four Seasons,Earth Angel,"pop, cover, covers, oldies, love songs"
Nelson Riddle,Lolita Ya Ya,"lounge, jazz, oldies, ultra-lounge, instrumental"
Banda El Recodo,Con la Tierra Encima,Unknown
Fu Manchu,King Of The Road,"Stoner Rock, rock, desert rock, stoner, hard rock"
Bloodhound Gang,A Lap Dance Is So Much Better When The Stripper Is Crying,"alternative, alternative rock, comedy, rock, funny"
Al Caiola,Bonanza!,Unknown
Jaguares,Fin,"Rock en Espanol, jaguares, latin, rock, Rock Latino"
Lou Reed,Make Up,"rock, glam rock, classic rock, 70s, singer-songwriter"
Banda El Recodo,Vida Prestada,Unknown
Banda Machos,Mi chica ideal,"latin, BANDA"
JAY-Z,So Ghetto,"Hip-Hop, hip hop, dj premier, rap, 90s"
Le Tigre,Eau D' Bedroom Dancing,"indie, riot grrrl, indie rock, rock, new york"
Los Tiranos Del Norte,Anillo Grabado,Unknown
Lou Reed,I'm So Free,"rock, classic rock, glam rock, 70s, Lou Reed"
Smash Mouth,"Come On, Come On","rock, ska, pop, Smash Mouth, alternative"
The Ataris,San Dimas High School Football Rules,"pop punk, punk, punk rock, The Ataris, emo"
"George Gershwin,  Philharmonia Orchestra",Rhapsody In Blue,"Classical, jazz, piano, gershwin, instrumental"
"Mos Def,  Q-Tip",Mr. Nigga,"Hip-Hop, hip hop, mos def, rap, underground hip-hop"
"Nas,  Aaliyah",You Won't See Me Tonight (feat. Aaliyah),"Timbaland, Nas, Hip-Hop, Aaliyah, hip hop"
Sam Cooke,Everybody Loves to Cha Cha Cha,"soul, 50s, 1959, rhythm and blues, oldies favorites"
Bobbi Humphrey,Harlem River Drive,"jazz, flute, funk, soul, jazz funk"
"The Beach Boys,  Mark Linett,  Sweet",White Christmas - 1991 Remix,Unknown
"The Beach Boys,  Mark Linett,  Sweet",Blue Christmas - 1991 Remix,Unknown
The Lettermen,When I Fall In Love,"oldies, easy listening, The Lettermen, harmonies, 60s Gold"
Korn,Dirty,"Nu Metal, alternative metal, alternative, Korn, alternative rock"
"Ray Conniff,  The Ray Conniff Singers",Medley: O Holy Night / We Three Kings of Orient Are / Deck the Halls with Boughs of Holly,christmas
Banda Cuisillos,Ritmazo,Unknown
Mos Def,Fear Not Of Man,"Hip-Hop, hip hop, rap, mos def, east coast rap"
John Mayall,Country Road,"blues, blues rock, country road, Folk Blues, x"
"Mr. Garrison,  The 3rd Grade Teacher",Merry F**king Christmas,Unknown
"John Williams,  London Symphony Orchestra",The Sith Spacecraft and the Droid Battle,"Soundtrack, Star Wars, instrumental, John Williams, score"
"""The Feline Composers Series""",The Mighty Lion,Unknown
"""Anita ODay"",  The Three Sounds",Whisper Not,Unknown
Harry Belafonte,I Heard the Bells on Christmas Day,"christmas, Weihnachten, xmas, classic Christmas, holiday"
"""The Canine Composers Series""",Nowhere to Run,Unknown
Boards of Canada,The Color Of The Fire,"electronic, ambient, electronica, idm, creepy"
"Dave Koz,  Chris Botti",Love Is On The Way,"Smooth Jazz, Dave Koz, jazz, up beat smooth jazz, uptempo smooth jazz"
Jimmy Ray,Are You Jimmy Ray?,"90s, pop, guilty pleasure, One Hit Wonders, daria"
The Spits,Bring,"Awesome, Favorite, badass, Good Stuff, nw2010"
The Devil Makes Three,Chained to the Couch,"smokin hot, folk, acoustic, americana, Mellow"
Vern Gosdin,Chiseled In Stone,"country, classic country, chiseled in stone, country legends, 60s"
Merle Haggard,The Way I Am,"country, classic country, 80s, 1980, joe"
Ike & Tina Turner,Workin' Together,"soul, 70s, blues, funk, female vocalist"
Los Toros Band,Quizas Si Quizas No - Version IODA,Unknown
Mannheim Steamroller,Hark! The Herald Trumpets Sing,"christmas, trumpet, Like, Seasonal, Yule"
Mannheim Steamroller,Veni Veni,"christmas, latin, choir, easy listening, bells"
Mannheim Steamroller,Lo How A Rose E'er Blooming,"christmas, instrumental, xmas, Like, Yule"
Mannheim Steamroller,Cantique De Noel (O Holy Night),"christmas, instrumental, new age, peaceful, classic"
Eric B. & Rakim,I Know You Got Soul,"Hip-Hop, old school, hip hop, 80s, rap"
Mannheim Steamroller,Traditions Of Christmas,"christmas, jazzysxmas, Yule, favorites, instrumental Christmas"
Los Gatos Negros De Tiberio,Lagrimas de Escarcha,Unknown
Guy,Teddy's Jam,"new jack swing, rnb, 80s, old school, Guy"
Leon Redbone,Winter Wonderland,"christmas, holiday, ragtime, elf, blues christmas"
Surface,Closer Than Friends - Single Version,Unknown
"L.T.D.,  Jeffrey Osborne",Back In Love Again,"soul, funk, 80s, dance, 70s"
Bobby Lyle,Aruban Nights,"jazz, keyboard, Smooth Jazz, bobby lyle"
The Winans,Ain't No Need to Worry,"gospel, Contemporary Gospel Tag, favorites, Gospel Jams, The Winans"
John Denver,Mr. Bojangles - Alternate Take - 1970,Unknown
Slayer,Piece By Piece,"thrash metal, metal, heavy metal, Slayer, thrash"
Strawberry Switchblade,Go Away,"80s, female vocalists, new wave, bubblegum goth, synthpop"
The Platters,Harbor Lights,"oldies, 60s, doo wop, rhythm and blues, 50's"
Peter Gabriel,Big Time - 2012 Remaster,"pop rock, new wave, new jack swing, dance pop, Funk Rock"
Novamenco,Lorca,"guitar, Flamenco, spanish guitar, Classical, instrumental"
Slayer,Criminally Insane,"thrash metal, metal, heavy metal, Slayer, thrash"
Tesla,Gettin' Better,"hard rock, Tesla, rock, classic rock, 80s"
Marvin Sease,Candy Licker,"candy Licker, soul, marvin sease, blues, rhythm and blues"
Antônio Carlos Jobim,Tereza My Love,"Bossa Nova, jazz, brazilian, latin jazz, Brazilian Jazz"
Mariah Carey,Fourth of July,"rnb, soul, Mariah Carey, female vocalists, pop"
Buddy Guy,Stone Crazy,"blues, Chicago Blues, guitar, buddy guy, electric blues"
Ratt,Slip of the Lip,"hard rock, hair metal, metal, 80s, classic rock"
The Smithereens,Behind The Wall Of Sleep,"80s, rock, power pop, alternative, alternative rock"
Poison,I Want Action,"hair metal, 80s, hard rock, rock, Glam Metal"
"Toquinho,  Vinícius de Moraes",Samba Da Benção,Unknown
Green Day,Reject,"punk rock, punk, rock, pop punk, green day"
They Might Be Giants,Ana Ng,"alternative, rock, geek rock, favorites, indie"
"Cherrelle,  ""Alexander ONeal""",Everything I Miss At Home,"rnb, soul, female vocalists, 80s, 80's"
Green Day,Haushinka,"punk rock, punk, alternative, rock, pop punk"
Brenton Wood,Take A Chance,Ballad
Tori Amos,A Sorta Fairytale,"female vocalists, piano, alternative, singer-songwriter, tori amos"
Wilco,Radio Cure,"indie, Alt-country, alternative, indie rock, rock"
Miles Davis,Someday My Prince Will Come,"jazz, trumpet, cool jazz, Miles, miles davis"
"The Band,  Dr. John",Such a Night (feat. Dr. John) - Concert Version,Unknown
Grupo Laberinto,El Cuerno De Chivo,Unknown
New Found Glory,Forget My Name,"pop punk, punk rock, punk, rock, new found glory"
Henry Lee Summer,I Wish I Had a Girl,"rock, 80s, pop, album rock, Southern Rock"
The Flaming Lips,Ego Tripping at the Gates of Hell,"indie, alternative, indie rock, rock, psychedelic"
The Chicks,Truth No. 2,"female vocalists, bluegrass, modern country, 2002, new traditionalist"
"Big Pun,  Fat Joe,  Triple Seis,  Armageddon,  Cuban Link","Glamour Life (feat. Fat Joe, Triple Seis, Armageddon & Cuban Link)",Unknown
Earshot,Get Away,"heard on Pandora, alternative metal, rock, hard rock, alternative rock"
Ashanti,Movies,"rnb, Ashanti, Love, sexy, heard on Pandora"
"The Band,  Van Morrison",Caravan (feat. Van Morrison) - Concert Version,Unknown
Barbra Streisand,Jingle Bells?,"christmas, jazz, 60s, cover, holiday"
The Intruders,Sad Girl,"soul, 60s, oldies, rnb, my mix"
Green Day,Jinx,"punk rock, punk, 90s, rock, pop punk"
The Charlie Daniels Band,Trudy,"Southern Rock, country, name, CDB Trudy, 70s"
Tesla,Heaven's Trail (No Way Out),"hard rock, Tesla, heavy metal, rock, classic rock"
Kathy Mattea,Where've You Been,"country, love song, female vocalist, easy listening, folk"
Babyface,Soon as I Get Home,"soul, slow jams, rnb, Babyface, love songs"
Randy Travis,He Walked on Water,"country, classic country, Randy Travis, american country, beautiful"
Jimi Hendrix,Pali Gap,"Psychedelic Rock, classic rock, rock, instrumental, guitar"
Mary Chapin Carpenter,Passionate Kisses,"country, female vocalists, mary chapin carpenter, Alt-country, 90s"
Digital Underground,Freaks of the Industry,"Hip-Hop, hip hop, 90s, Oakland, alternative hip hop"
Blues Traveler,Alone,"blues rock, rock, Jam Bands, blues, funky"
Sammy Davis Jr.,All Of You,"jazzyscrooners, jazz, cover, 50s, jazz vocal"
Johnny Horton,North To Alaska*,"folk, oldies, country western, 50s, rockabilly"
Jodeci,U And I,Unknown
The Kinks,(Wish I Could Fly Like) Superman,"rock, classic rock, hard rock, 70s, heard on Pandora"
The Cars,Double Life,"new wave, rock, 70s, classic rock, The Cars"
Kelis,Suga Honey Iced Tea,"female vocalists, rnb, Hip-Hop, soul, sexy"
Dire Straits,"Expresso Love - Live At Hammersmith Odeon, London/1983",Unknown
MC5,Let Me Try,"Garage Rock, garage, rock, 60s, Old School Punk"
Miles Davis,Miles Runs the Voodoo Down,"jazz, jazz fusion, Fusion, trumpet, miles davis"
"Alice Coltrane,  Pharoah Sanders",Journey In Satchidananda,"jazz, psychedelic, free jazz, experimental, harp"
Los Angeles Negros,A Tu Recuerdo,"latin, romanticas, Baladas, Balada Romantica, pura bohemia"
James Taylor,Long Ago and Far Away - 2019 Remaster,Unknown
Carly Simon,Anticipation,"70s, pop, female vocalists, singer-songwriter, Carly Simon"
Frankie Goes To Hollywood,San Jose,"new wave, synthpop, Hi-NRG, pop, cover"
Van Morrison,Brand New Day - 2013 Remaster,Unknown
Link Wray,Black River Swamp,"folk rock, mandolin, bodies of water, new favorites, colorful"
a-ha,Love Is Reason,"pop, 80s, new wave, synthpop, a-ha"
"Crosby,  Stills,  Nash & Young","Medley: The Loner, Cinnamon Girl, Down by the River - Live",Unknown
Led Zeppelin,Misty Mountain Hop - 1990 Remaster,Unknown
The Rolling Stones,Street Fighting Man,"rock, classic rock, 60s, the rolling stones, british"
The Beach Boys,Surf's Up - Remastered 2009,"psychedelic, Progressive, Avant-Pop"
Van Morrison,Come Running - 2013 Remaster,Unknown
Bobby Bloom,Montego Bay,"pop, 70s, One Hit Wonders, 1970, rock"
Elvis Presley,Silver Bells,"christmas, xmas, oldies, Elvis Presley, jazzysxmas"
Divine,Shoot Your Shot,"Disco, 80s, dance, pop, Hi-NRG"
The Beatles,Only A Northern Song - Remastered 2009,"Norway, pyschedelic rock, Psychedelic Peppermint, wtf ru talking about, random madness"
Toto Cutugno,Innamorati,"italian, 80s, pop, italiano, cantautori"
Mari Trini,Ayúdala,"Romantica, romantic"
Creedence Clearwater Revival,The Night Time Is The Right Time,"classic rock, 60s, Southern Rock, rock, swamp rock"
Led Zeppelin,Black Mountain Side - 1993 Remaster,Unknown
The Rolling Stones,Live With Me,"rock, classic rock, 60s, the rolling stones, blues rock"
Shailendra Singh,Hoga Tumse Pyara Kaun - Zamaane Ko Dikhana Hai / Soundtrack Version,Unknown
Daniela Romo,La ocasión para amarnos,"pop, female vocalists, latin pop"
Joe Cocker,Space Captain - Live At The Fillmore East/1970,Unknown
James Taylor,Steamroller Blues - 2019 Remaster,Unknown
The Jackson 5,Christmas Won't Be The Same This Year,"christmas, 70s, pop, holiday, jazzysxmas"
Van Morrison,Glad Tidings - 2013 Remaster,Unknown
Chicago,Colour My World - 2002 Remaster,Unknown
Harry Nilsson,Me and My Arrow,"70s, singer-songwriter, harry nilsson, Soundtrack, oldies"
Van Morrison,Everyone - 2013 Remaster,Unknown
Ray Price,For the Good Times,"country, classic country, ray price, oldies, for the good times"
Bob Marley & The Wailers,All Day All Night - Jamaican Version,Unknown
"Bobby Cruz,  Ricardo ""Richie"" Ray",Aguinaldo Navideño,Unknown
Robert Gordon,Rock Billy Boogie,"rockabilly, rock n roll, 70s, Rock and Roll, cover"
The Rosenberg Trio,Bossa Dorado - Instrumental,Unknown
The Rolling Stones,All Down The Line,"rock, classic rock, 70s, british, blues"
Slayer,Silent Scream,"thrash metal, metal, speed metal, Slayer, heavy metal"
Redbone,We Were All Wounded at Wounded Knee,"classic rock, 70s, pop, rock, oldies"
José Luis Perales,La Espera,Unknown
Russell Hitchcock,Someone Who Believes in You,Unknown
Conjunto Chaney,Vamos A Darnos Tiempo,"salsa, male vocalists, salsa romantica, Salsa Erotica, Vamos a Darnos Tiempo"
Marvin Gaye,Let's Get It On - Single Version,"soul, oldies, rnb, -toujours-, radiomelangesoir"
Cher,Dark Lady,"70s, pop, cher, female vocalists, rock"
Joe Bataan,Mujer Mia,"soul, 70s, funk, laidback, 1973"
Black Sabbath,Killing Yourself to Live - 2013 Remaster,Unknown
John Prine,Christmas in Prison,"christmas, folk, sad, C, 3"
Vicki Lawrence,The Night the Lights Went out in Georgia,"70s, One Hit Wonders, pop, billboard number ones 1970s, female vocalists"
Little Feat,Fool Yourself,"rock, little feat, classic rock, 70s, v6070"
張鎬哲,不是我不小心,Unknown
"Antonio Vivaldi,  Nigel Kennedy,  English Chamber Orchestra","Vivaldi: Violin Concerto in G Minor, RV 315 ""L'estate"" (No. 2 from ""Il cimento dell'armonia e dell'inventione"", Op. 8): II. Adagio",Unknown
The Hollies,Witchy Woman - 2007 Remaster,Unknown
Michael Jackson,Todo Mi Amor Eres Tu (I Just Can't Stop Loving You),"pop, 80s, michael jackson, spanish, r&b"
Black Sabbath,Tomorrow's Dream - 2014 Remaster,Unknown
Michael Jackson,Got To Be There - Single Version,"pop, soul, vugube62, 70s, ls"
Junior Byles,Beat Down Babylon,"reggae, roots reggae, MetroHadriani Loves this music, Beat Down Babylon Riddim, studio 1"
Hombres G,Indiana,"Hombres G, funny lyrics, marchosa, 800, bandachicos"
Deep Purple,Lazy,"hard rock, classic rock, rock, deep purple, 70s"
Caetano Veloso,You Don't Know Me,"mpb, brasil, tropicalia, Caetano Veloso, Do caralho"
Tanya Tucker,What's Your Mama's Name Child,"country, classic country, tanya Tucker, sad, jazzysfemvocalist"
Stephen Stills,Johnny's Garden,"stephen stills, classic rock, singer-songwriter, rock, country-rock"
Luis Enrique,Mi Mundo,"salsa, salsa romantica, latin, latino, latin music"
U2,Sunday Bloody Sunday - Live,"classic rock, seen live, rock, favourite, live"
"Whitney Houston,  Cissy Houston","I Know Him So Well - from ""Chess""","musical, abba, chess"
El Tri,El niño sin amor,"Rock en Espanol, fukin sweet, alternative rock, chill in, espanol 80"
John Denver,"Season Suite: Late Winter, Early Spring (When Everybody Goes to Mexico)","instrumental, ambient, guitar, John Denver, soothing"
NRBQ,Magnet,"favorites, alternative country, new discovery, plain perfect"
Steely Dan,Turn That Heartbeat Over Again,"classic rock, 70s, Jazz Rock, steely dan, rock"
Jacques Brel,"Amsterdam - Live, Olympia / 1964",Unknown
Leon Ware,Inside Your Love,"soul, 80s, cover, west coast, 1980"
"Crosby,  Stills & Nash",Marrakesh Express - 2005 Remaster,Unknown
Journey,Just the Same Way,"classic rock, hard rock, rock, journey, 70s"
Club Nouveau,Why You Treat Me So Bad,"80s, soul, funk, freestyle, slow jams"
Explosions In The Sky,The Only Moment We Were Alone,"post-rock, instrumental, ambient, post rock, beautiful"
"Naughty By Nature,  Big Pun",We Could Do It (feat. Big Pun),Unknown
Bill Frisell,Shenandoah (For Johnny Smith),"jazz, instrumental, americana, jazz fusion, stunning instrumentals"
Jimi Hendrix,...And the Gods Made Love,"classic rock, rock, psychedelic, experimental, jimi hendrix"
Jimi Hendrix,House Burning Down,"classic rock, rock, Psychedelic Rock, guitar, jimi hendrix"
Neil Diamond,"Canta Libre - Live At The Greek Theatre, Los Angeles/1972",Unknown
Eric Burdon & the Animals,Sky Pilot,"classic rock, 60s, rock, Psychedelic Rock, political"
Cory Morrow,21 Days,"seen live, country, acoustic, Good country, Red Dirt"
The Ethiopians,Engine 54,"ska, reggae, rocksteady, sic transit, skinhead reggae"
Charles Aznavour,Paris au mois d'août,"chanson francaise, Charles Aznavour, romantic, french, male vocalists"
Steve Miller Band,In My First Mind,"psychedelic, JTMlate60s, Progressive rock, Hammond, A reflection to look upon"
The Rolling Stones,Stray Cat Blues - 50th Anniversary Edition,"uh oh, disgoostang"
"Kid Rock,  Hank Williams,  Jr.","Cadillac Pussy (feat. Hank Williams, Jr.)","Southern Rock, 2000s"
David Crowder Band,O Praise Him (All This For A King),"worship, christian, christian rock, praise, david crowder band"
Simon & Garfunkel,Bookends Theme,"folk, singer-songwriter, classic rock, acoustic, 60s"
"""Ramblin Jack Elliott""",If I Were A Carpenter,Unknown
Grateful Dead,Hell in a Bucket,"classic rock, rock, Psychedelic Rock, vugube62, 80s"
Will Downing,A Million Ways,"Smooth Jazz, will downing, soul, love songs, Love"
Hugh Masekela,Grazing In The Grass,"jazz, instrumental, african jazz, african, trumpet"
The Beatles,When I'm Sixty-Four - Remix,Unknown
Rossington Collins Band,Don't Misunderstand Me,"Southern Rock, rock, classic rock, 70s, blues rock"
"Julie Andrews,  Philippa Bevans,  Rosemary Gaines,  ""Colleen OConnor"",  Muriel Shaw,  Gloria van Dorpe","I Could Have Danced All Night - from ""My Fair Lady""","musical, my fair lady"
"The Velvet Underground,  Nico",European Son,"rock, experimental, psychedelic, 60s, proto-punk"
Ray Price,Crazy Arms,"classic country, country, ray price, Crazy Arms, 50s"
"""Johnny Burnette & The Rock N Roll Trio""",The Train Kept A Rollin',Unknown
The Paragons,When the Lights Are Low,"pop, rocksteady, Love, ska, aaa"
Otis Rush,I Can't Quit You Baby,"blues, Chicago Blues, blues rock, guitar, electric blues"
The Band,Tears Of Rage - Remastered,"rock, soul, americana, folk rock, gospel"
Dinah Washington,Smoke Gets In Your Eyes,"female vocalists, jazz, jazz vocal, oldies, strings organs rubber wind"
William Bell,Every Day Will Be Like a Holiday,"rhythm and blues, soul, christmas, stax, Soundtrack Of My Life"
The Band,Long Black Veil - Remastered,Unknown
"Shep,  The Limelites",Daddy's Home,Unknown
Funeral For A Friend,Juneau,"emo, screamo, post-hardcore, rock, emocore"
The Zombies,A Rose For Emily,"60s, classic rock, beautiful, british, rock"
Overload,BLACK OUT,"eurobeat, anime, Initial D, weird, time"
The Velvet Underground,White Light/White Heat,"rock, proto-punk, psychedelic, alternative, 60s"
Lisa Loeb,Twinkle Twinkle Little Star,Unknown
The Who,I'm Free,"classic rock, rock, 60s, british, the who"
The Band,King Harvest (Has Surely Come),"folk rock, classic rock, The Band, rock, 60s"
Ray Conniff,Harmony,"easy listening, pop, Love, choral, eclectonia"
David Gates,"Suite: Clouds, Rain","70s, folk, soft rock, 1973"
John Holt,Help Me Make It Through the Night,"reggae, oldies, jamaica, roots reggae, john holt"
The Flying Burrito Brothers,Sin City,"country, country rock, Alt-country, americana, rock"
Ivy Queen,Quiero Saber,"Reggaeton, Ivy Queen, Hip-Hop, moenia, spanish"
Trans-Siberian Orchestra,Faith Noel,"christmas, instrumental, symphonic metal, Progressive metal, hard rock"
Chicago,Questions 67 and 68 - 2002 Remaster,Unknown
"Fruko Y Sus Tesos,  Joe Arroyo",Manyoma,"salsa, 80s, latin, male vocalists, SALSITA"
Peace and Love,Mariguana,Unknown
"Classics IV,  Dennis Yost",Traces,"60s, oldies, pop, rock, classic rock"
Ramones,"Here Today, Gone Tomorrow - 2017 Remaster","rock, Garage Rock"
Yehudit Ravitz,הילדה הכי יפה בגן,"Its all about the lyrics, white and red"
Blind Willie Johnson,It's Nobody's Fault but Mine,"blues, Classic Blues, slide guitar, blind willie johnson, bottleneck"
Foghat,I Just Want to Make Love to You - 2016 Remaster,my top songs
"Big Brother & The Holding Company,  Janis Joplin",Combination of the Two,"classic rock, 60s, psychedelic, blues rock, rock"
Otis Redding,Let Me Come on Home,"soul, 60s, quiet storm, funky, smooth"
"Blood,  Sweat & Tears",I Love You More Than You'll Ever Know,Unknown
Trace Adkins,Hot Mama,"country, Hot Mama, trace adkins, sexy, Love"
Senses Fail,Bloody Romance,"emo, screamo, rock, Senses Fail, alternative"
The Rapture,Echoes,"Misfits, indie, indie rock, post-punk, dance-punk"
"50 Cent,  Tony Yayo",Like My Style,"rap, hip hop, east coast rap, Hip-Hop, new york"
The Format,On Your Porch,"acoustic, indie, Mellow, Love, Veronica Mars"
Beyoncé,Yes,"rnb, r&b, Hip-Hop, soul, pop"
Manal,Avenida Rivadavia,"blues, rock nacional, wake up song, Fuck your God, this touches my soul"
Trace Adkins,Rough And Ready - Single Edit,Unknown
Augustus Pablo,Java,"reggae, dub, roots reggae, roots, melodica"
Otis Redding,Open the Door,"soul, favorites, oldies, 60s, quiet storm"
Ying Yang Twins,Naggin',"rap, hip hop, 2003, 2000s, Hip-Hop"
Kenny Chesney,Thank God For Kids,"country, Kenny Chesney, christmas, country christmas, male vocals"
Terri Clark,I Just Wanna Be Mad,"country, terri clark, Female country, modern country, female vocalists"
Julie London,Spring Will Be A Little Late This Year,Unknown
Kid Rock,Hillbilly Stomp,"Southern Rock, blues rock, country rock, rap metal, rock"
Willie Nelson,Stay All Night (Stay a Little Longer),"country, 70s, covers, fip, bluegrass"
Jim Croce,Age,"folk, folk rock, 70s, singer-songwriter, great song"
Steely Dan,King Of The World,"classic rock, rock, steely dan, 70s, Jazz Rock"
Antonio Aguilar,De Puntitas,Unknown
Lynyrd Skynyrd,Georgia Peaches,"Southern Rock, classic rock, 70s, blues, blues rock"
Tina Turner,I Don't Wanna Fight,"pop, female vocalists, rock, 90s, soul"
Rush,Cinderella Man,"Progressive rock, hard rock, classic rock, Rush, rock"
Tom Waits,Old Shoes (& Picture Postcards),"blues, rock, singer-songwriter, Tom Waits, folk"
Klaatu,We're Off You Know,"rock, pop, 70s, Progressive rock, beautiful"
Jerry Lee Lewis,Middle Age Crazy,"country, Whiskey Weed Women, www, listened"
Jackson Browne,Rosie - 2018 Remaster,Unknown
Queen,"Get Down, Make Love - Remastered 2011","classic rock, experimental, hard rock, psychedelic, glam rock"
Tears For Fears,Elemental,"rock, new wave, pop, Tears for Fears, beautiful"
Banda El Recodo,Los Viejitos,Unknown
Dire Straits,Six Blade Knife,"classic rock, rock, dire straits, guitar, 80s"
CHIC,Le Freak,"Disco, 70s, funk, dance, soul"
Roy Hargrove,September In the Rain,"jazz, September, instrumental, trumpet, jazz fusion"
Prince,Soft and Wet,"funk, prince, pop, rnb, sexy"
Marvin Gaye,"When Did You Stop Loving Me, When Did I Stop Loving You","soul, motown, marvin, zapfunk, afro armpit funk"
Parliament,Wizard Of Finance,"funk, p-funk, smooth, pop, chill"
Mariah Carey,All I've Ever Wanted,"pop, female vocalists, Mariah Carey, 90s, rnb"
Heart,Dog & Butterfly,"classic rock, rock, 70s, female vocalists, soft rock"
Amazing Rhythm Aces,The End Is Not in Sight (The Cowboy Tune) - Remastered,country
James Taylor,Shower the People,"folk, soft rock, james taylor, singer-songwriter, acoustic"
Warren Zevon,Desperados Under the Eaves,"rock, Warren Zevon, singer-songwriter, Cynical, sarcastic"
Philip Glass Ensemble,Knee 5,"minimal, electronic, Love, contemporary classical, Moonmusick"
Burton Cummings,Stand Tall,"70s, pop, Canadian, classic rock, rock"
Carpenters,There's A Kind Of Hush,"70s, easy listening, oldies, pop, carpenters"
Lynyrd Skynyrd,Searching,"Southern Rock, classic rock, rock, 70s, hard rock"
Tim Buckley,Phantasmagoria in Two,"folk, singer-songwriter, 60s, rock, melancholy"
Raffi,Who Built the Ark,Unknown
"Ricardo ""Richie"" Ray",Cabo E,Unknown
Small Faces,All Or Nothing,"60s, classic rock, rock, mod, british"
Steely Dan,I Got The News,"Jazz Rock, classic rock, steely dan, rock, 70s"
"Fela Kuti,  Afrika 70",Zombie,"afrobeat, african, jazz, funk, world"
Raffi,Les Petites Marionettes,childrens
Enchantment,Sunshine,"Enchantment - Sunshine, 70s, oldies, rnb, soul and rnb classics"
"Maze,  Frankie Beverly",Golden Time Of Day - Remastered,Unknown
Carpenters,Little Altar Boy,"christmas, covers, xmas, classic Christmas, Christmas Music"
Hot Rize,Nellie Kane,"bluegrass, newer bluegrass, flatpicking guitar, beautiful, kick ass"
"John Denver,  The Muppets",The Christmas Wish,"christmas, Yule"
Madball,Set It Off,"nyhc, hardcore, seen live, hardcore-punk, hardcore old school"
"John Denver,  The Muppets","Medley: Alfie, The Christmas Tree/ Carol For A Christmas Tree/It's In Every One Of Us",christmas
"John Denver,  The Muppets",Silent Night,"christmas, country, Soundtrack, guitar, peaceful"
Mariah Carey,Long Ago,"pop, rnb, r&b, 90s, Mariah Carey"
David Allan Coe,The Fish Aren't Bitin' Today,Unknown
April Wine,I Like To Rock,"classic rock, rock, hard rock, april wine, Canadian"
Yanni,The Rain Must Fall - Live,Unknown
