artists,name,genres
Rush,Test for Echo - 2004 Remaster,Unknown
The Rolling Stones,Under My Thumb - Mono,Unknown
Ride,Twisterella - 2001 Remaster,"alternative rock, jangle pop, dream pop"
Liberación,Mi Amante Fiel,Unknown
PIPER,Summer Breeze,Unknown
Bob Dylan,Man of Constant Sorrow - Live on 'Folk Songs and More Folk Songs' - March 1963,Unknown
*NSYNC,Digital Get Down,"pop, nsync, dance, 90s, boy band"
Stevie Wonder,Mr. Tambourine Man,"pop, 60s, soul, cover, Bob Dylan"
Vicente Fernández,Maldita Sea,Unknown
The Kinks,Dead End Street - Mono Mix,Unknown
Grupo Libra,Llévatela,Unknown
Gwen Guthrie,Ain't Nothin' Goin' On But The Rent,"80s, funk, Disco, disco funk, dance"
Ricardo Arjona,Tu Reputación,"ricardo arjona, latin, guatemala, Pop Latino, lentos"
Love,Seven and Seven Is,"Garage Rock, psychedelic, 60s, Psychedelic Rock, classic rock"
João Gilberto,Triste,"Bossa Nova, brasil, beautiful, brazilian, Joao Gilberto"
Townes Van Zandt,Mr. Mudd And Mr. Gold,"progressive country, streaming live versions, easyplay, im all in, storys"
Perry Como,Moon River,"oldies, jazz, romantic, perry como, beautiful"
"Gustav Holst,  Saint Paul Chamber Orchestra,  Christopher Hogwood","St. Paul's Suite, Op. 29 No.2, H 118: 3. Intermezzo: Andante con moto",Unknown
The Mamas & The Papas,Words Of Love - Single Version,Unknown
Los Toros Band,La Chiflera,Unknown
Gil Scott-Heron,When You Are Who You Are,"soul, funk, jazz funk, jazz, 70s"
Los Iracundos,Las Puertas Del Olvido,"romanticas, 70, theasoul, mariana, cac-soul"
José Luis Perales,Cómo Ha Pasado el Tiempo - Dedicada a Aldeas Infantiles S.O.S.,Unknown
Yusef Lateef,"Oscarlypso - Live At Pep's Lounge, Philadelphia / 1964",Unknown
Live,The Dam At Otter Creek,"rock, alternative rock, alternative, 90s, live"
Outkast,Decatur Psalm,"Hip-Hop, rap, hip hop, outkast, 90s"
Kurtis Blow,Basketball,"Hip-Hop, 80s, rap, Old School Hip Hop, hip hop"
Ozzy Osbourne,You're No Different,"heavy metal, hard rock, metal, classic rock, rock"
Bill Withers,Everybody's Talkin',"70s, cover, Bill Withers, RB, soul"
Vanessa Williams,The Sweetest Days,"soul, pop, female vocalists, emotive, easy listening"
Charles Brown,Merry Christmas Baby,"christmas, blues, christmas blues, christmas classic, Weihnachten"
"Vicious,  Doug E. Fresh",Freaks (feat. Doug E. Fresh),Unknown
Morcheeba,Trigger Hippie,"trip-hop, chillout, downtempo, female vocalists, trip hop"
"""Keb Mo""",Tell Everybody I Know,Unknown
"Lowell Lo,  劉天蘭",陪著你走,Unknown
"Method Man,  Raekwon",Meth Vs. Chef,"Hip-Hop, hip hop, rap, wu-tang, classic hip-hop"
Pantera,Good Friends and a Bottle of Pills,"thrash metal, groove metal, metal, pantera, heavy metal"
Kidsongs,O Christmas Tree,Unknown
Helix,Heavy Metal Love,"hard rock, heavy metal, rock, 80s, Canadian"
John Lee Hooker,Shake It Baby,"blues, delta blues, Classic Blues, boogie, john lee hooker"
Billy Joel,Easy Money,"rock, 80s, lost, classic rock, pop"
Joan Baez,Forever Young - Live On Tour / 1975,Unknown
"JUVENILE,  Paparue,  Turk,  Lil Wayne",Rich Niggaz,"hip hop, Dirty South, Hip-Hop, rap, Gangsta Rap"
ABBA,Happy Hawaii,"pop, abba, 70s, swedish, bonus track"
J.L.B. Y Cía,La Flaca,Unknown
Barrio Boyzz,Cerca De Ti,"latin, rnb, culposo"
Patti Smith,Pissing In a River,"rock, female vocalists, 70s, proto-punk, classic rock"
"""Kealii Reichel""",Kawaipunahele,Unknown
Ice Cube,Ghetto Bird,"rap, Gangsta Rap, hardcore rap, Ice Cube, Hip-Hop"
"Bob Wills,  Texas Playboys",Stay All Night (Stay A Little Longer),"country, chaser i, yet another 4, radio as i want it, before the 70s"
Sonido La Conga,La Charamusca,Unknown
Tom Jones,Thunderball - Live,pop
Cypress Hill,Break 'Em Off Some,"hip hop, Hip-Hop, rap, Cypress Hill, 90s"
ZZ Top,TV Dinners - 2008 Remaster,Unknown
Wings,Magneto And Titanium Man - Remastered 2014,Unknown
Les McCann,Burnin' Coal,"jazz, funk, groove, funky, soul jazz"
Rainbow,A Light In The Black,"hard rock, classic rock, heavy metal, rock, 70s"
J.J. Cale,Hold On,"blues, test, rock, soul, jjcale"
Another Sunny Day,You Should All Be Murdered,"indie pop, Sarah Records, twee, existential crisis songs, indie"
Matchbox Twenty,Busted,"rock, alternative rock, 90s, matchbox twenty, rob thomas"
Asia,Who Will Stop The Rain,"Progressive rock, arena rock, john payne, geoffrey downes, classic rock"
Héctor Lavoe,Déjala Que Siga,Unknown
Junior Parker,Taxman,"blues, soul, cover, beatles, sampled"
Vicente Fernández,Caballo Golondrino,Unknown
Hayedeh,Soghati,"fantastic, Masterpiece, All time favourite, toop, Namjoo-Kiosk"
Kylie Minogue,Locomotion,"pop, 80s, dance, cover, Kylie Minogue"
Seal,Violet,"soul, pop, ambient, 90s, Seal"
Tyrone Davis,Sure Wasn't Me,Unknown
Barry Manilow,Tryin' to Get the Feeling Again,"easy listening, pop, singer-songwriter, 70s, Barry Manilow"
Sun Ra,Nuclear War,"jazz, free jazz, Avant-Garde, political, war"
"Michelle Pfeiffer,  Maureen Teefy,  Lorna Luft",Girl For All Seasons,Unknown
Yasuaki Shimizu,Kakashi,"fip, 1982"
"Wolfgang Amadeus Mozart,  Cecilia Bartoli,  Vienna Chamber Orchestra,  György Fischer","Le nozze di Figaro, K.492 - Original version, Vienna 1786 / Act 2: ""Voi che sapete""",Unknown
Ricardo Aguirre,La Grey Zuliana,Unknown
Junior Parker,Tomorrow Never Knows,"soul, beatles cover, cover, lounge, dreampop"
Lou Donaldson,Aw Shucks,"jazz, favorites, Hammond, jazz fusion, laidback"
Marino,Cuando Clamo a Ti,Unknown
Freddie King,Palace Of The King,"blues, blues rock, electric blues, blues guitar, Modern Blues"
Grupo Pegasso,Se Acabó Quien Te Quería,Unknown
James McMurtry,Walk Between The Raindrops,"americana, alt country, Jills Station, singer-songwriter, Alt-country"
Brandy,Brokenhearted,"rnb, slow jams, 1995, 90s Rnb, classic"
Randy Travis,Whisper My Name,"country, classic country, Randy Travis, love songs, my favorite"
Elvis Presley,Pieces of My Life,"classic rock, rock, oldies, pop, 70s"
"Stan Getz,  Chick Corea,  Bill Evans",Con Alma,"jazz, saxophone, cool jazz, fip"
The Cast Of Grease 2,Who's That Guy?,"musicals, Soundtrack, musical, movie musical, Soundtracks"
"Cliff Richard,  The Shadows",Bachelor Boy - 2003 Remaster,Unknown
Los Gatos Salvajes,La Respuesta,"argentina, garage"
Death Angel,A Room With A View,"thrash metal, metal, Ballad, heavy metal, thrash"
Brian Regan,Whale Noises,"stand-up, comedy, funny, lonely, hilarious"
Voces Del Rancho,Lamberto Quintero,Unknown
The Mighty Mighty Bosstones,Royal Oil,"ska, ska punk, skacore, rock, alternative"
The Stranglers,(Get A) Grip [on Yourself] - 1996 Remaster,Unknown
Emmylou Harris,One of These Days,"country, Alt-country, 70s, bluegrass, alt country"
Luther Vandross,Your Secret Love,"soul, rnb, love songs, 80s, luther vandross"
The Beatles,She's Leaving Home - Remix,baroque pop
Sonora Ponceña,Te Vas De Mi,Unknown
Makoto Matsushita,This Is All I Have For You - 2018 Remaster,Unknown
"Astrud Gilberto,  Walter Wanderley",Tristeza,"Bossa Nova, jazz, female vocalists, brazilian, latin jazz"
Percy Sledge,Dark End of the Street,"soul, oldies, Love, blues, Favourites"
Fleetwood Mac,Welcome to the Room... Sara - 2017 Remaster,Unknown
The Adicts,Joker In the Pack,"punk, punk rock, British Punk, british, UK"
Haircut 100,Favourite Shirts (Boy Meets Girl),"new wave, 80s, pop, 1982, 1980's"
Bob Dylan,"Idiot Wind - Take 4, Remake with organ overdub","folk, melancholy"
Jefferson Airplane,My Best Friend,"Psychedelic Rock, classic rock, 60s, psychedelic, rock"
Twisted Sister,Leader of the Pack,"hard rock, cover, heavy metal, hair metal, rock"
Antônio Carlos Jobim,Look To The Sky,"Bossa Nova, jazz, brazilian, latin, instrumental"
Manuel & The Music Of The Mountains,Cuando Calienta El Sol,Unknown
Emmylou Harris,Till I Gain Control Again - 2003 Remaster,Unknown
The Who,My Wife,"classic rock, rock, hard rock, 70s, british"
Steppenwolf,It's Never Too Late,"classic rock, rock, 60s, Steppenwolf, blues rock"
Camilo Sesto,Obertura,Unknown
Doctor Dump,One Day,Unknown
Neil Young,Old King,"rock, folk, folk rock, Neil Young, country"
Latimore,Let's Straighten It Out,"soul, blues, Old School soul, Latimore, 70s"
Mark Wills,Wish You Were Here,"country, male vocalists, mark wills, Love, Favourite Songs"
Sting,We'll Be Together,"rock, 80s, pop, sting, british"
Philip Aaberg,Diva - Sentimental Walk,"Smooth Jazz, cool, joga, philip aaberg, jazz nostalgia"
Joan Sebastian,Selene,Selene
Barry White,You Turned My Whole World Around,"soul, barry white, 70s, funk, male vocalists"
Tina Turner,One Of The Living - Extended Version,Unknown
Kenny G,End of the Night,"saxophone, jazz, Smooth Jazz, kenny G, TheJazzCafeLovedTracks B"
Super Cat,Ghetto Red Hot,"dancehall, reggae, super cat, ghetto red hot, ragga"
"Kenny G,  Peabo Bryson",By The Time This Night Is Over (with Peabo Bryson),Unknown
Andy Williams,Try to Remember,"easy listening, romantic, waltz, dansercz-waltz"
Juan Luis Guerra y 440,Si Tú Te Vas,Unknown
The Animals,Outcast,"rock, classic rock, The Animals, 60s, british"
Neil Young,Such a Woman,"folk, rock, Neil Young, folk rock, classic rock"
Michael Jackson,Free,"pop, 80s, michael jackson, 5 of 10 stars, bad 25"
The Remains,Don't Look Back,"60s, Garage Rock, garage, rock, 60s garage"
Faces,Bad 'n' Ruin,"blues rock, rock, Rock and Roll, classic rock, 70s"
Violent Femmes,Prove My Love,"80s, alternative, alternative rock, rock, indie"
The Breeders,Safari,"rock, alternative, Grunge, alternative rock, female vocalists"
"Lennie Niehaus,  Clint Eastwood",Claudia's Theme - Version Eight,Unknown
The Cult,Nirvana,"rock, 80s, hard rock, Gothic Rock, british"
Doctor Dump,What I Want to Be,Unknown
Sylvester,Over And Over,"Disco, 70s, pop, soul, gay"
The Paragons,On the Beach,"rocksteady, reggae, ska, MetroHadriani Loves this music, 60s"
Type O Negative,Paranoid,"cover, doom metal, Gothic Metal, metal, Gothic"
Dolly Parton,Here I Am,"country, female vocalists, female, pop, soul"
Counting Crows,Walkaways,"counting crows, rock, Mellow, alternative, alternative rock"
Whitney Houston,Where You Are,"whitney houston, soul, pop, 80s, female vocalists"
Fleetwood Mac,When I See You Again - 2017 Remaster,Unknown
Otis Redding,Nobody Knows You (When You're Down and Out),"soul, Deep Soul, memphis soul, Southern Soul, 60s"
Bruce Springsteen,Mansion On the Hill,"rock, folk rock, singer-songwriter, folk, classic rock"
Failure,The Nurse Who Loved Me,"space rock, alternative rock, rock, 90s, indie rock"
Domingo Quiñones,Tu Como Estas,"salsa, latin"
Joan Sebastian,La Mamá De Los Pollitos,Unknown
Red Hot Chili Peppers,Sikamikanico,"rock, Soundtrack, alternative rock, alternative, Funk Rock"
Joan Sebastian,La Hablantina,La Hablantina
Motörhead,Vibrator,"heavy metal, hard rock, Motorhead, metal, speed metal"
Super Cat,Don Dada,"reggae, dancehall, favorites, roots reggae, jamaican"
Los Brincos,Un Sorbito de Champagne,"spain, beat, pop, oldie, ye-ye"
Frank Sinatra,The Impossible Dream (The Quest),"pop, jazz, oldies, male vocalists, crooners"
David Allan Coe,You Never Even Called Me by My Name,"country, classic country, David Allan Coe, outlaw country, male vocalists"
John Williams,Suo Gân,Unknown
Simon & Garfunkel,Richard Cory,"folk, 60s, rock, classic rock, oldies"
Eagles,Take It Easy - Live; 1999 Remaster,Unknown
Bob & Marcia,To Be Young Gifted and Black,"reggae, ska, 70s, lovers rock, education"
Brian Eno,St Elmo's Fire - 2004 Digital Remaster,"art rock, art pop"
Julio Iglesias,Preguntale,"julio iglesias, 80s, ellos"
Bruce Springsteen,Streets of Fire,"rock, heartland rock, classic rock, 70s, hard rock"
George Strait,Rudolph The Red-Nosed Reindeer,Unknown
"JAY-Z,  M.O.P.",U Don't Know - Remix,Unknown
Creedence Clearwater Revival,Poorboy Shuffle,"classic rock, swamp rock, instrumental, roots rock, rock"
Andy Kim,Baby I Love You,"60s, pop, romantic, Canadian, oldies"
"Ian Giles,  John Spiers,  Jon Bowden,  Graham Metcalfe",Bully in the alley,Unknown
Pixies,Motorway to Roswell,"rock, alternative, alternative rock, indie, 90s"
Studio Musicians,Medley Plena,Unknown
Regina Belle,Baby Come To Me,"soul, female vocalists, quiet storm, slow jam, Love"
Atreyu,Ain't Love Grand,"metalcore, hardcore, metal, screamo, atreyu"
ZZ Top,Give It Up,"rock, Southern Rock, blues rock, classic rock, 70s"
Jeanette,Comienzame a Vivir,"Love, radio paola"
Death Cab for Cutie,This Charming Man,"cover, covers, indie, indie rock, death cab for cutie"
Stevie Ray Vaughan,"Shake for Me - Live at Steamboat 1874, Austin, TX - April 1980",Unknown
"Richard M. Sherman,  Robert B. Sherman,  Michael Ball,  Emma Williams,  George Gillies,  Carrie Fletcher,  Robert Scott",Chitty Chitty Bang Bang: Chitty Chitty Bang Bang,Unknown
Hella,Biblical Violence,"math rock, experimental, instrumental, noise, Progressive"
Faith Evans,Love Don't Live Here Anymore,"rnb, cover, 90s, r n b, Hip-Hop"
Dr. Hook,A Little Bit More,"70s, classic rock, pop, rock, 1976"
"Louis Armstrong,  Duke Ellington",Mood Indigo - 1990 Remaster,Unknown
Ray Conniff,Sleigh Ride,"christmas, conniff, easy listening, Yule, Navidad"
Three 6 Mafia,Walk Up To Your House,"Gangsta Rap, Horrorcore, aggressive music, memphis rap, Southern Hip Hop"
Doris Day,The Deadwood Stage (Whip-Crack-Away!),Unknown
"Franz Liszt,  Jorge Bolet","Liebestraum, S. 541, No. 3",Unknown
"Johann Sebastian Bach,  Glenn Gould","Goldberg Variations, BWV 988: Variation 28 a 2 Clav.",Unknown
"Les Paul,  Mary Ford",How High The Moon,"guitar, Swing Jazz, les paul, jazz, mtnbear pick"
Donell Jones,Life Goes On,"rnb, Soul food, Donell Jones, Turn-me-on, Love"
"Johann Sebastian Bach,  Glenn Gould","Goldberg Variations, BWV 988: Variation 30 a 1 Clav. Quodlibet",Unknown
Selena y los Dinos,Contigo Quiero Estar,"pop, 80s, latin, Ballad, latin pop"
"Johann Sebastian Bach,  Glenn Gould","Goldberg Variations, BWV 988: Variation 29 a 1 ovvero 2 Clav.",Unknown
Billy Vera & The Beaters,At This Moment,"80s, 123 drippy sappy, Love, romantic, At This Moment"
The Flaming Lips,"Yoshimi Battles the Pink Robots, Pt. 2","noise, electronic, rock, alternative rock, experimental"
The Rolling Stones,Before They Make Me Run - Remastered,"classic rock, rock, 70s, blues, the rolling stones"
Andy Williams,"Love Theme from ""Romeo and Juliet"" - A Time for Us",Unknown
Otep,Blood Pigs,"metal, Nu Metal, Female fronted metal, female vocalists, death metal"
The All-American Rejects,Time Stands Still,"rock, The All-American Rejects, emo, alternative, punk rock"
Neil Young,Cripple Creek Ferry,"rock, classic rock, folk rock, singer-songwriter, 70s"
Pure Prairie League,Two Lane Highway,"two lane highway, rock, classic rock, country, relaxing"
Leon Redbone,Shine on Harvest Moon,"jazz, different, country, Like, alt. country"
"Johann Sebastian Bach,  Glenn Gould","Goldberg Variations, BWV 988: Variation 26 a 2 Clav.",Unknown
Porter Wagoner,The Carroll County Accident,"classic country, country, porter, my country favorites, Porter Wagoner"
Fleetwood Mac,Never Going Back Again - Acoustic Duet,Unknown
"Haruomi Hosono,  イエロー・マジック・バンド",四面道歌 (2019 Remastering),"jazz fusion, exotica, city pop"
Harold Budd,Bismillahi 'Rrahmani 'Rrahim,"ambient, atmospheric, late night, contemporary classical, melancholy"
"Bow Wow,  Xscape",Bounce With Me (feat. Xscape) - Edited Album Version,Unknown
Burt Bacharach,"South American Getaway - From ""Butch Cassidy And The Sundance Kid"" Soundtrack",Unknown
Mel Tormé,Happy Together,"jazz, easy listening, swing, oldies, vocal jazz"
Elvis Costello,Welcome To The Working Week,"new wave, rock, singer-songwriter, under two minutes, british"
"Mary Costa,  Bill Shirley,  Chorus - Sleeping Beauty","An Unusual Prince / Once Upon A Dream - From ""Sleeping Beauty""/Soundtrack Version",Unknown
George Harrison,Hear Me Lord - Remastered 2014,Unknown
Leo Dan,Tengo Todo por Hacer,Unknown
Liberación,Cuando Yo Te Quiero Hablar,Unknown
Bad Religion,Anesthesia,"punk rock, punk, favorites, hardcore, rock"
Neil Young,Birds,"rock, singer-songwriter, classic rock, Neil Young, folk"
"John Rutter,  The Cambridge Singers,  City of London Sinfonia",Love came down at Christmas,Unknown
Bongzilla,Greenthumb,"stoner metal, Sludge, stoner doom, doom metal, Stoner Rock"
Bruce Springsteen,Factory,"rock, heartland rock, hard rock, classic rock, folk rock"
Tommy Roe,Sweet Pea,"oldies, 60s, bubblegum, pop, Tommy Roe"
"Evelyn ""Champagne"" King",The Show Is Over,"soul, rnb, female vocalist, Ballad, 1977"
Tiger Army,In The Orchard,"psychobilly, Tiger Army, rockabilly, punk rock, punk"
Dillard & Clark,Polly,"country, chill, 60s, test, folk-rock"
Exposé,"Seasons Change - 7"" Version",Unknown
Anything Box,Living In Oblivion,"new wave, 80s, electronic, synthpop, synth pop"
Art Garfunkel,A Heart In New York,"folk, soft rock, singer-songwriter, pop, 70s"
J.J. Cale,Thirteen Days,"blues, blues rock, rock, guitar, singer-songwriter"
The Kinks,Shangri-La - Mono Mix,Unknown
Clutch,Careful with That Mic...,"hard rock, rock, Stoner Rock, alternative rock, unexpectedly awesome"
"Arnold Schoenberg,  Arditti Quartet,  Håkon Austbø,  Louise Bessette","Weihnachtsmusik for 2 Violins, Cello, Harmonium and Piano",Unknown
Bad Religion,Flat Earth Society,"punk, punk rock, political, rock, favorites"
The Flaming Lips,Are You a Hypnotist??,"psychedelic, indie, alternative, rock, experimental"
Van Morrison,Take It Where You Find It - Remastered,Unknown
J.J. Cale,Boilin' Pot,"rock, 70s, Southern Rock, favorite songs, country-rock"
Mary J. Blige,All That I Can Say,"rnb, soul, female vocalists, 90s, mary j blige"
Talking Heads,The Good Thing - 2005 Remaster,"70s, art rock, 1978"
Pages,If I Saw You Again,fip
Lou Reed,Street Hassle,"rock, epic, classic rock, singer-songwriter, Pitchfork 500"
"Master P,  MC Peaches,  Mercedes",Crazy Bout Ya,crazy bout ya
The Urge,Jump Right In,"ska, reggae, alternative, 90s, daria"
Hieroglyphics,Classic,"Hip-Hop, hip hop, underground hip-hop, Hieroglyphics, rap"
The Queers,See You Later Fuckface,"punk, punk rock, 80s, 1980s, Punk Favorites"
Cameo,It's Serious,"funk, Disco, 1977, disco funk, 70s"
Carpenters,Touch Me When We're Dancing,"pop, carpenters, easy listening, 70s, oldies"
The Chicks,If I Fall You're Going Down with Me,"country rock, modern country, 2001, matraca berg, early 2000s country"
Patrick Cowley,Megatron Man,"Disco, space disco, Dance 80s, Hi-NRG, synthwave 4x4"
Killswitch Engage,Life to Lifeless,"metalcore, metal, hardcore, Melodic Death Metal, killswitch engage"
Barbara Mandrell,(If Loving You Is Wrong) I Don't Want To Be Right,"barbara mandrell, classic country, country legends, country, female vocalist"
K-Ci & JoJo,Life,"rnb, 90s, soul, rhythm and blues, male vocalists"
Willie Nelson,"Whiskey River - Live at Harrah's Casino, Lake Tahoe, NV - April 1978",Unknown
Iron & Wine,Lion's Mane,"folk, indie, singer-songwriter, acoustic, Mellow"
K-Ci & JoJo,This Very Moment,"soul, Love, favorites, quiet storm, romantic"
"Neil Young,  Crazy Horse",F*!#in' Up,"rock, fip, Neil Young, 6 of 10 stars, temazo de tres pares de cojones"
Tito Rojas Y Su Orquesta,Doble,salsa
Corb Lund,Time to Switch to Whiskey,"country, seen live twice, My Country, pertin"
Alacranes Musical,Magdalena,"Alacranes musical, Alacranes Musical- Magdalena"
Trace Adkins,(This Ain't) No Thinkin' Thing,"country, trace adkins, 90s, male, modern country"
Linda Perhacs,Chimacum Rain,"folk, female vocalists, singer-songwriter, psychedelic, psych folk"
CKY,Close Yet Far,"rock, alternative rock, CKY, alternative, metal"
"""Oscar DLeón""",Ven Morena,Unknown
Fleetwood Mac,"World Turning - Live at The Fabulous Forum, Inglewood, CA 08/29/77; 2013 Remaster",Unknown
Village People,Y.M.C.A. - Single Version,disco tag
"The Band,  Todd Rundgren",Stage Fright - Remastered 2000,Unknown
"John Williams,  London Symphony Orchestra",Anakin and Padmé,"Soundtrack, Star Wars, Classical, beautiful, favourite"
Deitrick Haddon,Sinner's Prayer,"gospel, Sinners Prayer, black gospel, deitrick haddon, Contemporary Gospel"
Led Zeppelin,Tangerine - 1990 Remaster,Unknown
Los Tigres Del Norte,La Bronco Negra,Unknown
Vince Guaraldi Trio,Schroeder,"jazz, jazz piano, piano, cool jazz, aproragadozo loves this music"
Killswitch Engage,The Element of One,"metalcore, metal, killswitch engage, hardcore, melodic metalcore"
Chicago,No Tell Lover - 2002 Remaster,Unknown
The Doobie Brothers,Dependin' on You,"classic rock, 70s, soft rock, rock, doobies"
"Hank Williams,  Jr.",America Will Survive - Studio Version,Unknown
Janis Joplin,To Love Somebody,"blues, classic rock, 60s, rock, blues rock"
"Linkin Park,  Aceyalone,  Chairman Hahn",Wth>You (Chairman Hahn Reanimation) [feat. Aceyalone],Unknown
"Linkin Park,  Stephen Richards",P5hng Me A*wy (Mike Shinoda Reanimation) [feat. Stephen Richards],Unknown
Son Seals,Funky Bitch,"blues, Blues Tag, funk, Chicago Blues, Modern Blues"
Billy Joel,Rosalinda's Eyes,"rock, billy joel, Jazz Rock, freaks and geeks, classic rock"
Bob Dylan,Winterlude,"folk rock, classic rock, singer-songwriter, winter, singer songwriter"
Los Invasores De Nuevo León,"Hierba, Polvo Y Plomo",Unknown
"""Oscar DLeón""",Lloraras,Unknown
Electric Light Orchestra,The Whale,"rock, classic rock, instrumental, 70s, grins and smiles and giggles and laughs"
Cheo Feliciano,Salí Porque Salí,"latin, salsa"
Vicente Fernández,"Me Voy Lejos, Lejos, Lejos",Unknown
Dolly Parton,"It's All Wrong, but It's All Right","country, Dolly Parton, female vocalists, singer-songwriter, american"
Naughty By Nature,Yoke the Joker,"east coast hip hop, hip hop, Hip-Hop, rap, 90s"
Angel Witch,Atlantis,"heavy metal, NWOBHM, metal, 80s, speed metal"
Black Label Society,Graveyard Disciples,"heavy metal, metal, Black Label Society, rock, hard rock"
Billy Ray Cyrus,Busy Man,"country, beautiful, 90s, 1998, great song"
Mountain,For Yasgur's Farm,"classic rock, 70s, hard rock, blues rock, Southern Rock"
Gang Starr,Just To Get A Rep,"Hip-Hop, hip hop, rap, Gang Starr, old skool"
Madonna,Lucky Star - US ReMix Version,"80s, 90s, remix, Madonna, mother"
John Cale,Big White Cloud,"singer-songwriter, John Cale, rock, art rock, proto-punk"
Vicente Fernández,De Que Tamaño Me Quieres,Unknown
Betty Wright,Tonight Is the Night (Pts. 1&2),Unknown
Charley Pride,Christmas In My Home Town,"christmas, country christmas, xmas, holiday, Weihnachten"
Beck,Tropicalia,"Bossa Nova, alternative, indie, beck, 90s"
Sigur Rós,Sigur 3 (Untitled),"post-rock, instrumental, ambient, easy listening, icelandic"
Mountain,Never In My Life,"classic rock, hard rock, Southern Rock, rock, mountain"
Bee Gees,Night Fever - Serban Mix,Unknown
Rod Stewart,Passion,"rock, 70s, classic rock, 80s, soft rock"
Cross Canadian Ragweed,Whiskey River,"cross canadian ragweed, country, Alt-country, Red Dirt, americana"
Slowdive,Ballad Of Sister Sue,"shoegaze, dream pop, british i like, shoegazegdchill, melancholy"
The Ventures,"Walk, Don't Run","instrumental, Surf, 60s, guitar, oldies"
Rush,Cygnus X-1 Book II: Hemispheres,"Progressive rock, classic rock, hard rock, epic, rock"
The Kinks,Apeman - Mono Mix,Unknown
George Harrison,I Dig Love - Remastered 2014,Unknown
John Williams,You Are the Pan,"Soundtrack, instrumental, John Williams, hook, Classical"
Cass Elliot,It's Getting Better,"rock, lost, dancy, Life Soundtrack, cinematographical"
David Bowie,Unwashed and Somewhat Slightly Dazed - 2015 Remaster,Unknown
Oscar Peterson,Christmas Waltz,"christmas, jazz, waltz, xmas, fip"
Captain & Tennille,Don't Forget Me,Unknown
Journey,Winds of March,"classic rock, hard rock, journey, 80s, 70s"
"Henry Purcell,  The Prague Brass Soloists","Trumpet Tune in C Major, Z. 697",Unknown
"Sly,  Slick & Wicked",Confessin a Feeling - Live,Unknown
Buddy Holly,Love Is Strange,"oldies, 50s, rock n roll, rockabilly, Love"
Jim Cummings,"Steady as the Beating Drum (Reprise) - From ""Pocahontas""/Soundtrack Version",Unknown
Dana Gould,Crappy Jobs & Bingo,fun
UFO,Too Hot to Handle - 2008 Remaster,Unknown
"John Williams,  London Symphony Orchestra",The Princess Appears,"Soundtrack, Star Wars, John Williams, score, easy listening"
Neil Young,I Believe in You,"rock, classic rock, singer-songwriter, folk rock, Neil Young"
Moving Pictures,What About Me?,"pop, 80s, soft rock, australian, cheese"
Hum,The Pod,"90s, alternative, Grunge, alternative rock, beautiful"
Aretha Franklin,Share Your Love with Me,"soul, female vocalists, rhythm and blues, 60s, rnb"
Stevie Ray Vaughan,Voodoo Child (Slight Return) - Live,"rock, blues, blues rock, stevie ray vaughan"
A Taste Of Honey,Sukiyaki - Remastered,Unknown
Manfred Mann,"A ""B"" Side","classic rock, rock, pop, 60s, british"
Musiq Soulchild,Newness - Album Version (Edited),Unknown
Diana Ross,Reach Out And Touch (Somebody's Hand),"motown, soul, 70s, female vocalists, pop"
Vince Guaraldi Trio,Joe Cool,"jazz, cool jazz, Mellow, cool, piano"
Three Plus,Undercover Lover,Hawaiian
"Johann Sebastian Bach,  Orpheus Chamber Orchestra","Herz und Mund und Tat und Leben, Cantata BWV 147: No. 10 Jesu, Joy Of Man's Desiring (Arr. by Guillermo Figueroa)","Classical, sophisticated, famous, Iconic, fancy"
Gorillaz,19-2000 - Soulchild Remix,"electronic, alternative, gorillaz, dance, remix"
Joan Sebastian,Pedacitos De Luna,Unknown
The Doobie Brothers,Here to Love You,"rock, classic rock, soft rock, drum break, michael mcdonald"
The Stooges,T.V. Eye,"proto-punk, punk, Garage Rock, 70s, rock"
South Park Mexican,Lobo Wanna Raise,Unknown
Derek & The Dominos,Little Wing,"classic rock, blues rock, rock, cover, Jimi hendrix cover"
Charley Patton,Down The Dirt Road Blues,"blues, delta blues, 20s, 1920s, bluegrass"
Brandy,What About Us?,"rnb, pop, Brandy, dance, darkchild"
"Beanie Sigel,  Freeway",Roc The Mic,"Hip-Hop, Beanie Sigel, rap, roc-a-fella, east coast rap"
Phish,Character Zero,"Jam, rock, jam band, phish, favorites"
Cliff Richard,Dreamin' - 2001 Remaster,Unknown
Neutral Milk Hotel,Song Against Sex,"indie, indie rock, Lo-Fi, Elephant 6, rock"
Michael Chapman,You Say,"folk, 60s, british, dig that bass"
South Park Mexican,Dallas to Houston,Unknown
Doug and the Slugs,Too Bad,"rock, Canadian, the word bad, cheery, early mtv years"
